"","movie_nm","score","reg_date","contents"
"5679","은밀하게 위대하게","4.0","2013.08.10","김수현 아니면 망했을 영화 "
"5680","센과 치히로의 행방불명","10.0","2013.08.10","재미있기도 하고 신기하기도 한 영화이런거 좋아하시는 분들께 강추 "
"5681","블러드 다이아몬드","10.0","2013.08.10","진짜 숨겨진 수작이란 이런 영화를 두고 하는 말임이때부터 디카프리오의 연기 세계에 빠져듦 타이타닉 때보다액션이면 액션 스토리면 스토리 정말 교훈적이고 짜임새 있게 잘 만들어진 영화 "
"5682","감기","10.0","2013.08.10","유료시사회 보고 왔음괜찮네요 박진감도 있고 "
"5683","7번방의 선물","5.0","2013.08.10","너무 뻔하고 비현실적인 이야기라서 전혀 공감이 되지못했습니다 아쉽게 류승룡씨의 연기도 어색하게만 느껴져서 더 몰입이 힘들었어요 ㅠㅠ "
"5684","설국열차","2.0","2013.08.10","어설픈 상징과 지루한 설교식의 대화 뜬금없고 진부한 송강호식 유머 "
"5685","은밀하게 위대하게","10.0","2013.08.10","짱잼있다 영화보고 운건 오랜만이다 부도 있으면좋겠는데 주인공이주금ㅠㅠㅠㅠ "
"5686","더 테러 라이브","10.0","2013.08.10","연기화면구성소리구성 완전 소름이돋앗습니다보고난뒤 와 와멍때렷네요 ㅜㅋㅋㅋ 정말 콩닥콩닥하면서 본 명작입니다 "
"5687","숨바꼭질","10.0","2013.08.10","시사회로밧는데진짜스토리도탄탄하고반전에반전을거듭할수록정말무섭고흥미진진햇어요진짜재밋습니다 "
"5688","설국열차","9.0","2013.08.10","엔딩만 좋았으면 점 만점에 a였을텐데아무튼 영화보는 내내 넘 재미있었어요 "
"5689","레드: 더 레전드","9.0","2013.08.10","이병헌이 돋보인영화 액션도 훌륭했음 "
"5690","설국열차","10.0","2013.08.10","리뷰를 보고나면 영화를 한번 더 보고싶어진다 배우들 연기도 좋았고 내용도 영상미도 다 좋았어요 봉준호감독♡ "
"5691","브레이크","6.0","2013.08.10","저예산영화인가 결말도 찜찜하고 스토리라인도 부족함 "
"5692","한번 뿐인 내 인생","9.0","2013.08.10","보면 정말 여행가고 싶어지는 영화 스페인의 아름다운 풍경을 배경으로 세 친구의 모험과 사랑을 가볍게 담아서 보기 좋았음 "
"5693","그 시절, 우리가 좋아했던 소녀","10.0","2013.08.10","결말덕에 더 여운이 남는 영화 주인공둘다 너무 잘생기고 이쁘다 "
"5694","신세계","10.0","2013.08.10","재미있게 봤어요긴장감있는 이정재씨 연기 인상적이네요황정민씨도 역시 짱 "
"5695","백악관 최후의 날","5.0","2013.08.10","내용은 신선했는데 어색한 한국어하며 엉성한 스토리라인 아쉽다 "
"5696","월드워Z","9.0","2013.08.10","깔끔한 좀비영화 징그럽거나 잔인함보다는 스토리가 있어서 재미있었으나지루한부분과 불필요한 부분도 보임 "
"5697","설국열차","10.0","2013.08.10","아주 좋았습니다 현시대에 대한 비판적인 내용과 스펙터클한 전개도 맘에 들었습니다 "
"5698","더 콜","9.0","2013.08.10","아쉬운 전개가 있었지만 몰입도나 스릴만큼은 최고 "
"5699","설국열차","10.0","2013.08.10","내 인생 최고의 영화인듯우리 사회의 모든 단면의 축소판인듯 그 모든 모습을 하나의 영화로 담을 수 있다니 많은 것을 생각하게 하는 영화입니다 최고를 외칩니다 "
"5700","설국열차","8.0","2013.08.10","정말 있었습니다 꼭 우리 현실을보는 것 같았습니다 근데 끝마무리는 별로였던것같습니다 "
"5701","설국열차","9.0","2013.08.10","설국 열차 영화에 대한 호불호는 지극히 당연한 거라고 여겨집니다 영화에 대한 기대나 관점이제각기 다를 수 밖에 없지만 개인적으로는 무척 재미있게 보고 여러가지 것들에 대해 생각하게 되는 좋은 영화라고 여겨딥니다 같이 본 친구는 영화 중반쯤 잠들었습니다 이 또한 하나의 관점이 아닐런지 "
"5702","설국열차","0.0","2013.08.10","할말이없음 "
"5703","더 테러 라이브","6.0","2013.08.10","저예산티가 너무 많이 나네 한 억정도 들었을려나분 중 하정우만 분 이상 나오네하정우 연기만 아니면 점 정도 될려나리널리티가 많이 부족함 "
"5704","군사통제구역 팔이공지대","9.0","2013.08.10","아쉬운점이 있다하지만 저예산영화라는 점과 신인배우들이라는 점을 감안해서 본다면만점을 줘도 전혀 아깝지 않았다아쉬운점도 좀 보였기에 분발하라는 의미에서 점 재미있었어요 "
"5705","설국열차","10.0","2013.08.10","평점이 별로라서 기대안했는데 엄청 재밌네요 "
"5706","설국열차","9.0","2013.08.10","괴물 이후 최고의 영화네요 "
"5707","설국열차","10.0","2013.08.10","가족끼리 보고왔습니다점 점 점 주신 분들 도무지 이해가 안가네요다른 분들 말처럼 보는동안 보고난 후 이런저런 생각을 하게됩니다 그리고 그 생각들이 제 삶에서 행동으로 나오게 되길 바랍니다설국열차 추천합니다전주에서 "
"5708","군사통제구역 팔이공지대","10.0","2013.08.10","생각보다 재미있었음 "
"5709","설국열차","0.0","2013.08.10","돈으로 여론조작 흥행위국정원 여론조작 바뀐애 위내용도 허술 스토리 전개도 허술 연출도 유치찬란설국열차 수출금지 시켜라 국격 하락한다 봉준호 영화 다시는 안본다괴물도 짠한디 이것도 만만치 않네설국열차 평점 알바들 총동원돈으로 여론몰이 ㅠㅠ "
"5710","더 울버린","10.0","2013.08.10","짱 "
"5711","잃어버린 세계를 찾아서 2 : 신비의 섬","10.0","2013.08.10","킬링타임 굿 "
"5712","설국열차","10.0","2013.08.10","살아남기위한 사람들의 몸부림이 격렬하게 마음을 움직였다 모든 캐릭터가 살아움직였고 봉준호 감독님의 연출력 말이 필요없었다 "
"5713","감기","7.0","2013.08.10","제법 괜찮은 스케일의 한국재난영화 하지만 그에 미치지 못하는 진부한 캐릭터들 빠지지 않는 가족애 권위적인 관료들가장 답답했던건 돕는 행동이 일정 선을 지켜 설득력이 있어야 하는데 장혁역은 너무 과해 오히려 몰입을 방해한다는점 가족애 좀 빼고 담백하게 연인 정도만 구하는 한국재난영화좀 볼 수 없을까 "
"5714","지.아이.조 2","7.0","2013.08.10","편보다 못했음 "
"5715","설국열차","3.0","2013.08.10","노력점수 점 유치해서 보느라고 매우 힘들었음 "
"5716","설국열차","9.0","2013.08.10","기차 안에 집약된 인간사 바닥부터 최고점까지혁명의 끝은 구원 희망일까 불행일까여운은 물론이고 영상미 스토리까지 완벽했던 설국열차 "
"5717","설국열차","6.0","2013.08.10","솔직히 별로 "
"5718","더 테러 라이브","9.0","2013.08.10","아주 조아결말이 사살로 안끝나고 정부에 배신당한 기분을 그대로 묘사한 장면자폭멋져굿정형적인 외국영화 결말보다 헐 나음국제영화제 출품하면 상 받는건 당연 "
"5719","감기","10.0","2013.08.10","배우들의 연기력과 스토리진행에 감동받았어요 대박기대됩니다 ㅅ "
"5720","눈에는 눈 이에는 이","6.0","2013.08.10","지난 과오 누적 속 가공할 위력의 무기를 노리는 자들이 많아진 실제상황 핵 폭탄급의 자멸 자폭을 노리고 갖추고 있는 무리들이 많아진 현재 시점의 위태로운 역사의 모습 그 중 한반도왜곡 된 가담항설 속 문외적 한계 속 혼란에 의하여 결국 인적자원들특히 태양인 해이 예상 가능한 살상 테러에 의하여 충돌이 되며 암살이 자행이 되어 역사의 큰 오점을 남기는데 "
"5721","감기","1.0","2013.08.10","뻔하고 지루하고 장혁 쓸데없는 영웅심리 오지랖퍼 수애 이기적인 민폐녀 수애딸 말안듣다가 쓸데없이 말들어서 화근을 만들고 대한민국에 차인표가 연기한 대통령은 없다는거 "
"5722","설국열차","9.0","2013.08.10","정말 여운이 계속 남는한번더 보고픔 "
"5723","오블리비언","6.0","2013.08.10","흥미로운 주제이나 이미 흔해져 버렸고 매력없는 여배우들에 전개가 밋밋하다해서지루하다 런닝타임을 분만 줄이자 엉 "
"5724","설국열차","10.0","2013.08.10","재밌기만 하고만 "
"5725","늑대아이","9.0","2013.08.10","비현실적이랄 수 있는 소재이긴하나 어차피 영화나 애니 드라마들은 모두 인간의 상상을 영상으로 만들어내는거 아닌가 정작 중요한 메세지는 못 찾고 뭐 눈엔 뭐만 보인다고 수간이니 어쩌니 하는거 보니까 기막힌다이 애니는 참 다양한 메세지를 전달해주는것 같다 순수한사랑 강한 모성 자아찾기 등잘 만들었다 "
"5726","설국열차","9.0","2013.08.10","원작을 못봐서 모르겠지만 원작이 더 대단할듯 평점정도는 되는듯 던져주는 메시지들도 많고 보여주는 메세지들도 있고 각자 느끼는 메세지들도 있을테고 흥행작품성 측면에서 괜찮은 영화인듯 영화자체 보다는 원작을 보고 싶게 만드는 영화 던져주는 메세지와 내가 느끼는 메시지가 개인적으로 강했음 "
"5727","센과 치히로의 행방불명","10.0","2013.08.10","진짜 짱임영화 강추ㅋ "
"5728","설국열차","10.0","2013.08.10","보고나면여운도남고계속 영화에대해생각하게돼요잘봤습니다 "
"5729","더 테러 라이브","9.0","2013.08.10","오하정우반전에 반전 "
"5730","더 테러 라이브","6.0","2013.08.10","어떻게 설국열차를 이영화에 비교할 생각을 하는지 ㅎㅎ 이영화는 딱 돈 안쓴티가 나고 하정우 혼자 너무 많은 시간을 담당한 나머지 영화관에서 조는 사람도 상당수였음 하정우 연기가 괜찮아서 점드립니다 설국열차 본사람들이 글을쓰는건지 앞으론 본사람만 티켓인증하고 글쓰는 코너좀 따로 마련해주길 "
"5731","다찌마와 리 - 악인이여 지옥행 급행열차를 타라","9.0","2013.08.10","WWWJKJKCOM HAPPY카지노입니다 저희는 안전 신뢰정직으로 많은 분들이 이용중입니다 여름이벤중이구요 관전가능하니 구경먼저 하셔두 됩니다WWWJKJKCOM "
"5732","설국열차","10.0","2013.08.10","평점이 너무 낮네요 보고나서도 계속 여운이 남는 영화에요 표면적인것 이외에 영화가 담고자 했던 상징적인 의미를 생각해보면서 보면 좋을것 같아요 "
"5733","은밀하게 위대하게","7.0","2013.08.10","이질감에서 달동네에서 겪었던 류환과 그들은 어느새 동질감을 느끼면서 안타깝게 죽는 모습이 슬펐다독재와 공산주의에 희생 당하는 그들은 은밀하지도 위대하지도 않는것 같다끊어지는 듯한 전개 긴장감과 박진감은 좀 부족한듯액션은 볼만 했지만 배우들에 비해 좀 아쉬웠다소문난잔치에 왠지 겉만 화려한 아쉬움 "
"5734","다찌마와 리 - 악인이여 지옥행 급행열차를 타라","0.0","2013.08.10","여기두 알바가 있네 "
"5735","설국열차","10.0","2013.08.10","명불허전 "
"5736","더 테러 라이브","10.0","2013.08.10","반전의 반전을 더하는 영화입니다 이 영화 안 보시면 후회합니다 "
"5737","포 엘렌","7.0","2013.08.10","쌉싸름하다 "
"5738","트라이앵글","10.0","2013.08.10","많은 한국사람들이 보면 복많이 받고 행운이 따르는 그런 내용 "
"5739","설국열차","2.0","2013.08.10","내용이 아이들과 보기에는 너무나 잔인하고 솔직히 재미가 너무 없었어요솔직히 말리고 싶네요 "
"5740","설국열차","0.0","2013.08.10","말이필요없는영화 "
"5741","태극기 휘날리며","10.0","2013.08.10","개슬퍼요 ㅠㅠ 이건 진짜 명작임 굿 "
"5742","설국열차","10.0","2013.08.10","시간이라는 시간이 무색할 만큼 정말 재미있었다신경안쓴부분이 없는 그 디테일함배우들의 열연오늘 보고 왔는데 자꾸 생각나 "
"5743","설국열차","0.0","2013.08.10","알바들에게 일감주기 위한 영화 손바닥으로 하늘을 가리시오 "
"5744","더 테러 라이브","10.0","2013.08.10","결말이 내가 원하는게 아니라 좀 아쉽지만 연출이라던가 CG도 괜찮고 몰입감도 좋고 진행도 빠르고 긴장감 넘치고 무엇보다 하정우 연기는 아주 쩔어 그냥 "
"5745","걸어도 걸어도","10.0","2013.08.10"," 연기가 진짜 자연스럽다 소소한 대화에 드러난 가족의 어색함 갈등 연민 영화가 요동이 없어 재미 없을 수 있으나 최고 점수를 주고 싶다 좀 뒤틀렸지만 가족으로 돌아가고픈 서로를 잘 표현한 듯 "
"5746","더 테러 라이브","10.0","2013.08.10","하정우 원맨쑈최고네 설국열차볼까 이거 볼까 하다가 이거 선택했는데 잘 선택한듯 "
"5747","포화속으로","10.0","2013.08.10","ㅋㅋㅋㅋㅋㅋㅋㅋㅋ "
"5748","오하이오 삿포로","8.0","2013.08.10","소이 널 알아보지 못해 미안해 "
"5749","설국열차","2.0","2013.08.10","재미도 없고 감동도 없고 정말 실망스러운 영화보는 순간 무조건 실망하는 영화 "
"5750","설국열차","0.0","2013.08.10","간만에 와이프랑 영화보러갔다가 눈쌀찌프리고 나온 영화다 나중에 다운받아서 시간 날때나 넘겨보기해서 보시길 기대했다가는 큰코다침 "
"5751","더 테러 라이브","10.0","2013.08.10","대박 분만 한거 같아요 ㅜㅜ "
"5752","설국열차","10.0","2013.08.10","놀랐습니다이런 내용이었다니 "
"5753","숨바꼭질","6.0","2013.08.10","공든탑이 무너지는 건 한순간 "
"5754","머드","10.0","2013.08.10","진지하면서 물흐르듯이 자연스런 연출과 배우들의 연기가 훌륭한 아주 재밌게 본 영화 "
"5755","라스트 스탠드","0.0","2013.08.10","이것도 영화라고 찍었냐 긴장감은 눈꼽만큼도 없고 fbi나 범죄자들이나 프로다운 맛도 없고 ㅎㅎ 그냥 b급 영화 하나 찍었구만 아놀드에 휘태커 두 배우가 아깝다 평점은 왜 이렇게 높아 깎아야지 "
"5756","더 테러 라이브","10.0","2013.08.10","오늘봤는데 시간가는 줄 모르고 봤네요 교훈적이었고 특히 엔딩이 인상적이었습니다 추천합니다 "
"5757","터보","9.0","2013.08.10","유치할것 같았는데 기대이상 "
"5758","프로메테우스","10.0","2013.08.10","에어리언 프리퀄을 기대하고 본다면 기대이하SF를 포기하고 본다면 기대이상신이 인간을 창조한 이유는 인간이 인간과 같은 로봇을 만드려는 이유와 같다 "
"5759","설국열차","4.0","2013.08.10","영화를 보았지만어케 흥행 위를 달리까 으아했다 흥행위 이해가 안가는 영화 그냥 영화일분이다 철도기관사가 보기에 철도영화는 아니고 밀폐된 공간일뿐 열차는 아니다 "
"5760","미쓰GO","10.0","2013.08.10","고현정 진짜 좋다 "
"5761","터보","10.0","2013.08.10","너무 재미있어요이 영화 정말 추천합니다 "
"5762","감기","8.0","2013.08.10","장혁수애 연기는 물론 조연들과 특히 어린애의 연기가 재미를 더하고 중후반이 갈수록 극적인 분위기를 만드네요시간이 지루한감이 없네요 기대보다 재미있게 잘 봤습니다 "
"5763","설국열차","10.0","2013.08.10","굿 "
"5764","설국열차","9.0","2013.08.10","애낳고 년만에 영화봄 헉 한국감독이 이런 영화를 깜놀 "
"5765","갓파쿠와 여름방학을","10.0","2013.08.10","자연을 사랑해줘야겠어요 ㅠㅠ 역시 제일 나쁜것 인간인가용ㅜㅜ "
"5766","더 테러 라이브","10.0","2013.08.10","하정우의 연기는 정말이지 나무랄 데가 없다 "
"5767","더 테러 라이브","9.0","2013.08.10","이런 영화는 봐줘야한다 대박 "
"5768","배틀쉽","2.0","2013.08.10","아무리 화려한 볼거리도 연출이 이야기가 받쳐주지 않으면 쓰레기게다가 분이라니이거 만든 감독 차기 연출작이 핸콕라니망하려고 작정한거지 "
"5769","감기","10.0","2013.08.10","번방의 선물 수준의 어린애 연기 헐리웃수준의 그래픽 올해 개봉된 영화중 가장 스케일이 크네요 만족점수 드립니다 "
"5770","설국열차","10.0","2013.08.10","총리아줌마 연기 개쩜너무 재밌게 봤어용ㅎ "
"5771","설국열차","10.0","2013.08.10","더 테러보다 훨씬 낫네 우리 나라 사람들 영화수준 참 낮네 "
"5772","감기","10.0","2013.08.10","오늘시사회갔었는데 모처럼재미있게본영화에요 "
"5773","늑대아이","10.0","2013.08.10","진짜재밌어ㅠㅠㅠ "
"5774","7번방의 선물","10.0","2013.08.10","하 오랫만에 울어봤네요 슬픈 내용이지만 마지막엔 웃으면서 울수 있었습니다 그나저나 박신혜 짱짱걸 "
"5775","판의 미로 - 오필리아와 세 개의 열쇠","9.0","2013.08.10","델 토로의 블록버스터 영화보다 이 영화가 훨씬 좋다 "
"5776","감기","9.0","2013.08.10","지휘권 장면에 만감이 교차했지만 영화가 재난발병을 소재로 하다보니 극적인 장면과 대사을 곳곳에서 발견할 수 있었다 특히 딸을 찾아 위험지대로 질주하는 인해의 모습이 인상적 이었다 엔딩크레딧에서 작은 단편 찢어진 빨간치마 이야기도 재미있었다 ㅎㅎ "
"5777","설국열차","8.0","2013.08.10","나쁘지 않았습니다볼만합니다 "
"5778","설국열차","9.0","2013.08.10","재밌어용 "
"5779","더 테러 라이브","9.0","2013.08.10","방금 보고 나왔슴다 젊은 천재감독의 탄생입니다 한순간도 긴박감을 놓치지 않네요 다음 작품 기대됩니다 "
"5780","텍사스 킬링 필드","5.0","2013.08.10","편집이 중구난방 스릴이 전혀 느껴지지 않는다 "
"5781","원스 어폰 어 타임 인 아메리카","10.0","2013.08.10","내생애 최고의 영화 "
"5782","에픽:숲속의 전설","2.0","2013.08.10","미국인의 자연에 대한 인식은 아직 미개하구나 인간 관계에서야 선악의 대립이 있을 수도 있지만 이 영화의 세계관은 적절하지 않다 "
"5783","감기","10.0","2013.08.10","참 잘만들었어요 여러모로 "
"5784","명탐정 코난 : 시한 장치의 마천루","10.0","2013.08.10"," "
"5785","의형제","7.0","2013.08.10","송강호 강동원도 이렇게 조화가 되는구나 근데 항상 느끼지만 첩보물 간첩나오는 영화들은 좀 현실성을 많이 반영해서 찍었음 좋겠다 재미와 감동이 있었지만 여러므로 많이 아쉬운 영화 킬링타임용으로는 좋을 듯 "
"5786","Q - 섹스힐링","10.0","2013.08.10","님들 이거 자막 어떻게 구하죠 죽어라 찾아도 영문자막밖에 안나오네요 영어 할줄도 모르는데 "
"5787","미들 맨","8.0","2013.08.10","포르노에 대한 썰이 참 설득력있네 "
"5788","호로비츠를 위하여","7.0","2013.08.10","가족영화로 참 좋을 영화 슈만의 트로이메라이를 들을 때면 이 영화의 잔상이 떠오른다 감동이 있는 그런 영화 개인적으로 엄정화의 연기를 좋아하지만 이 영화에서는 다른배우들에게 더 눈길이 간다 "
"5789","은밀한 유혹","8.0","2013.08.10","이십년이 넘은 지금 봐도 참 잘만들었다 느껴지는 영화 이런 신선한 소재의 로맨스 역시 나쁘지 않다 데미무어 역시 정말 아름다웠었지 "
"5790","퍼펙트 겟어웨이","7.0","2013.08.10","처음에 닉은 왜 작가라는 클리프를 연신 긁는지 차분해 보이던 클리프도 결국 약이 올라 반격하려는 줄 알았는데시원한 배경에서의 하품이 나지 않도록 고심한 빠른 전개와 대반전에 더해진 세미고어컷장점인 빠른전개 반전덕에 마지막 엔딩의 약간의 허한 느낌 "
"5791","퀸카로 살아남는 법","8.0","2013.08.10","민걸즈 최고의 하이틴 무비 주인공인 린지로한보다 레지나 조지 레이첼 맥아담스가 더 매력적이였었던 "
"5792","마지막 4중주","10.0","2013.08.10","만든 사람들 이름들이 다 나올때까지 흐르는 그 악장이 다 끝날 때까지먼저 일어나면 안될 듯한 연주장 분위기 연전에 사놓은 베토벤 중주는 어려워 제껴놓았었는데 다시 꺼내 들어봐야겠음ㅎ "
"5793","쿼런틴","0.0","2013.08.10","그냥정신없다 "
"5794","나 홀로 집에 3","6.0","2013.08.10","에서 끝났어야 했다 케빈이 안나오자나 주인공 바뀜 원래 그 어떤 시리즈도 전작만 못하는법 "
"5795","에픽:숲속의 전설","0.0","2013.08.10","짜증 나는 캐릭터들미국서 벌써 DVD가 나온 이유가 있다 "
"5796","더 테러 라이브","10.0","2013.08.10","진짜재밌음bb "
"5797","나 홀로 집에 2 - 뉴욕을 헤메다","8.0","2013.08.10","크리스마스가 될 무렵이면 가장 먼저생각나는 영화 전작만큼 재밌는 그런 가족영화 시리즈의 으뜸이 아닐지 "
"5798","나 홀로 집에","8.0","2013.08.10","년도 더 된 영화라는게 믿겨지지가 않는다 언제봐도 재밋는 홈얼론 나홀로 집에 코미디도 이런 코미디가 있을련지 참 잘만들었다 최고의 코미디 영화 "
"5799","우리 형","7.0","2013.08.10","가족애를 말하고 싶은건 잘 알겠다 근데 막판에 들어가서 그건 뭔데 아쉬운 영화 더 좋은 결말을 만들 수도 있지 않았을련지 허술한 시나리오가 조금 아쉬웠다 김해숙 신하균의 명연기로 인해 원빈의 연기가 많이 부족하고 어색해 보이기까지 했다는 "
"5800","죽지않아","9.0","2013.08.10","개그로 시작해서 점점 사람이 무서워지는 영화 "
"5801","설국열차","10.0","2013.08.10","누구에겐 그저 그런영화누구에겐 가슴이 먹먹할정도로 감독의 메세지가 전해졌던 생애 최고의 영화 "
"5802","아저씨","8.0","2013.08.10","관객들이 좋아라 할 그런 영화 엉성한 부분도 많았고 그래픽은 요 근래 나온 다른 한국영화들이 비해 꽝이였다 허나 그 어떤 한국영화들보다 멋진 액션이 있었고 한장면도 놓지고 싶지 않게 하는 몰입력이 생기게 하던 영화였다 거기에 감동과 원빈까지 있었다 원빈 원맨쇼라기보단 이정범 감독 원맨쇼란 표현이 "
"5803","군사통제구역 팔이공지대","10.0","2013.08.10","독립영화 만세 "
"5804","레미제라블","8.0","2013.08.10","감동도 있었고 말 그대로 탄탄했다 완전하기 보다 온전했으며 좋은 뮤지컬영화 한편 본 그런 느낌이였다 그런데 톰후퍼 감독 영화를 볼 때마다 내가 느끼는건 항상 뭔가 전개방식이 너무 지루할 때가 있기도 한 점이다 바즈루어만의 전개방식이 너무 수박 겉핥기라면 톰후퍼는 껍질까지 먹으려한다 "
"5805","은밀하게 위대하게","10.0","2013.08.10","진짜 짱인듯 마지막 액션씬 너무 슬퍼용 ㅠㅠ "
"5806","킹스 스피치","8.0","2013.08.10","살면서 한번도 생각해보지 않았던 그런 주제를 갖고 영화를 만들었다 피곤한 사람들이 보면 졸 수도 있다 허나 배우들의 명연기와 감동을 주는 스토리 그 자체 만으로도 이 영화는 가치가 있다 허나 전개해나가는 과정에서 조금 지루했던건 사실이다 톰후퍼 다른영화들도 약간 그런 느낌이 있던데 흠 "
"5807","유주얼 서스펙트","10.0","2013.08.10","너무나도 유명한 결말로 알고봤는데도 긴장감과 소름이 돋는다 "
"5808","설국열차","9.0","2013.08.10","눈으로 가득찬 설국을 달리는 기차에서 청량감도 느껴지지만 자본주의 시스템종교 등 우리사회를 구성하는 시스템의 비정함과 그 시스템 속에 살아가는 우리네 삶의 하찮음이 느껴져 뒷맛이 개운치는 않은 영화입니다 재밌고 신나는 영화 찾으시는 분에게는 비추입니다 "
"5809","말죽거리 잔혹사","8.0","2013.08.10","잘만들어진 한국영화 권상우는 이만한 작품 앞으로 평생 못만날듯 그만큼 이 작품이 좋았다는 뜻이다 영화로 보는 그시절 그런데 정말 독특하게도 그 연기 못하던 한가인이 은주라는 캐릭터에는 참 잘맞는듯 하다 "
"5810","설국열차","10.0","2013.08.10","이 영화보고 재미없다 놈들은 심히 아이큐가 의심스럽다 그냥 때려부시는 헐리웃 영화나봐라 "
"5811","더 테러 라이브","9.0","2013.08.10","세기 화두는 신자유주의 폐해인 양극화일듯 첫장면부터 사회고발적인 대사가 예사롭지 않다 자칫 지루할 수 있는 한정된 공간을 상당히 짜임새있게 그려나감 시청률을 최상위에 두는 저급한 방송매체 어떠한 사건도 여론조작 가능하단 것 방송인의 윤리문제등 현실감 있게 잘 만듦 이경영연기가 돋보임 엔딩좋았음 "
