"","movie_nm","score","reg_date","contents"
"1","숨바꼭질","8.0","2013.08.19","평점을보니 어찌 이런 영화를 억지스럽고 말도안된다는 스토리라 하는데 글쎄요각본과 연기자의 연기는 최고인거같아요암튼 너무 재미있게 봤습니다 "
"2","숨바꼭질","5.0","2013.08.19","뭐든 주관적인 것이 작용하는 것이고 직접 보고 판단하는것이제일 현명할 듯 돈이 아까운지 아닌지는난 돈이 아까웠음 영화보면서 헛 웃음도 나오고나름 배우들의 연기력에 그나마 조금의 위안 "
"3","철도원","0.0","2013.08.19","뭐가 슬프지심심해 죽는줄 알았네 "
"4","설국열차","0.0","2013.08.19","설국열차의 돈벌이를 위해 더 테러 라이브의 상영시간을 밤 시로 밀어버린 CJ설국열차 만든 모든 이들이 고생했겠으나 관심 밖의 영화가 되어버렸습니다 이러지 맙시다 "
"5","숨바꼭질","10.0","2013.08.19","평점이 좋지않아서 다른영화보려다 시간이 맞지않아서 우연히 보게됬는데 최근에 긴장의 끈을 놓지못하고 정말 재밌게 봤어요아무리 취향에 따라다르다지만 지나친혹평은 좀앞으로 관람평 믿기 어려울듯 "
"6","언어의 정원","10.0","2013.08.19","황금빛 비 스쳐지나가는 비 등등 비를 영상으로 고스란히 그려낸 작품 얼마나 감독이 많은 노력을 거쳐 영화를 만들었는지 그대로 보이는 영화 짧은 시간과 제한된 상영관이란 한계에도 작품 자체가 가지고 있는 완성도는 전혀 손색이 없다 행복을 전해주는 영화 "
"7","숨바꼭질","9.0","2013.08.19","생각치 못할 반전과 두근대는 심장 아직도 잊지못하네요 슬프면서 무섭고 그냥 귀신보다 사람이 더무섭다 그런생각까지 드는 좀 찐한 교훈을 주는 영화예요 "
"8","감기","9.0","2013.08.19","저도 정말 재미있게 봤습니다 다소 비현실적인 부분도 있지만 뭐 영화니까 분당을 주무대로 해서 그런지 더 와닿았음 ㅎㅎ 박민하양 아주 귀엽네요 "
"9","포스 카인드","6.0","2013.08.19","페이크 다큐인지 뭔지 모르겠지만 다만 알래스카 놈 지역에서 실종사건이 많이 발생한 건 엄연한 사실이라네요mbc 서프라이즈에도 나왔었죠 "
"10","명탐정 코난 : 수평선상의 음모","10.0","2013.08.19","코난 팬인데요솔직히 초반에는 쫌 지루해요하지만 뒤로 갈수록 완전 반전의 반전그리고 나름 눈물도 나고넘 즐거웠어요 "
"11","명탐정 코난 : 수평선상의 음모","10.0","2013.08.19","코난 팬인데요솔직히 초반에는 쫌 지루해요하지만 뒤로 갈수록 완전 반전의 반전그리고 나름 눈물도 나고넘 즐거웠어요 "
"12","설국열차","6.0","2013.08.19","많이 아쉬운영화 점 정도 적당하구요야박하게 점 줘도 할 말 없어요이유는 주려는 메세지가 너무 많다보니일상에 찌들어 피로를 풀거나 사고의 전환등을 기대하는데 전혀 못미쳤다고 볼 수 있어요관객몰이는 배급회사의 힘이라고 생각되어져서 씁쓸 "
"13","감기","9.0","2013.08.19","기대하지 않고 보러갔는데 넘 재미있네요후회안함 "
"14","감기","2.0","2013.08.19","뻔하네요배우분들 열연이 아까운 "
"15","일대종사","1.0","2013.08.19","무얼 기대하든 그 이하를 보게 될것이다이런영화에 점날리는 사람들은 시간이아주 많은 사람한마디로 시간아까운 영화좀 잔잔히 스며드는점은 있으나그래도 시간 아까움 "
"16","더 테러 라이브","10.0","2013.08.19","goooooooooooooooooooooooooooood "
"17","감기","10.0","2013.08.19","정말 현실에서 있을법한 이야기 정치계사람들이 봤으면한다 시간가는줄 모르고봤음 재미있어요 "
"18","그 시절, 우리가 좋아했던 소녀","0.0","2013.08.19","쩝 허무하네 "
"19","숨바꼭질","8.0","2013.08.19","전 개인적으로 재밌게 봤습니다내용상으론 현실적인 면에서 다소 억지스런 부분이 있긴하지만그러니 영화죠ㅎ그렇다고 실망스럽다고 할 정도 는 아닌 것 같습니다손현주문정희씨 연기는 아주 좋았던 것 같습니다 "
"20","포레스트 검프","6.0","2013.08.19","병들어 돌아온 제니이해가 안감 "
"21","퍼시잭슨과 번개도둑","7.0","2013.08.19","그냥 볼만하다 "
"22","오블리비언","7.0","2013.08.19","시종일관 하이얀 SF 어느새 믿고 보는 톰 크루즈 "
"23","낙엽귀근","10.0","2013.08.19","정말 잘봤습니다신선한 영화 감동있고 웃기기도 하고 보면서 여러번 웃었네요ㅋ "
"24","감기","10.0","2013.08.19","정말 재미있게봤어요강추하고싶어요 "
"25","설국열차","10.0","2013.08.19","설국열차 넘재밌게보고왔어요 얼마나 몰입해서 봤던지 영화를 다보고나니 흰남방이 다구겨져있었다는 ㅎㅎ 기존의 한국영화와는 확연히 차이가나네요 강추 "
"26","숨바꼭질","3.0","2013.08.19","개인적인 취향에 따라 다르겠지만제 기준으로 본 내용은 너무나도 현실적이지 못한 내용에 실망이 앞서는 영화배우의 명연기가 극본의 조잡함으로 묻히고 터무니 없는 긴장감에 무서움 보다는 왜지 하는 이해하기 힘든 영화 "
"27","감기","9.0","2013.08.19","처음과끝이 지루한감이 있지만중간부분은 정말 재미있었어요 "
"28","숨바꼭질","2.0","2013.08.19","그냥 나중에 OCN에서 보세요돈내고 극장에서 보기 아까운 영화 "
"29","엑스텐션","7.0","2013.08.19","골키퍼 없는데 골을 넣지도 못하네 그리고 한 사람이 자동차 두대를 어떻게 운전해 "
"30","에픽:숲속의 전설","9.0","2013.08.19","Fantastic 한큐에 알다마 쓰리쿠션과 가락을 뺀 느낌 "
"31","더 테러 라이브","10.0","2013.08.19","천만 기대해봅니다 오늘 한국사회에 대해 느끼는 대다수 사람들의 분노를 응축해서 보여준 것 같습니다 그리고 속시원히 터뜨려줍니다 설국열차와 더불어 한국영화의 진일보한 성과입니다 신예감독 김병우님과 제작진에 박수를 "
"32","숨바꼭질","6.0","2013.08.19","누군 치밀한 각본이라고 하는데 말도 안되는 억지설정들이 몰입을 힘들게 하던데요주인공 와이프는 왜 경찰에 신고 안하고 집으로 갈 생각만 하는지또 문정희가 애들하고 실갱이 하고 있을때 어쩜 지나가는 사람 한명도 없었는지글구 여자가 남자를 그렇게 이길 수 있나요 괴력이라고 해야 하나요 억지설정에 웃음만 "
"33","크로즈 썸","6.0","2013.08.19","히로시때문에 보았는데 레나가 눈에 띄네 긴장감도 없고 뭔가 어색하고 많이 어설픈다 "
"34","숨바꼭질","7.0","2013.08.19","부제우리집이야장르남녀 격투액션 "
"35","숨바꼭질","8.0","2013.08.19","치밀한 각본과 손현주의 연기력이 돋보인 잘 만든 공포물 단 지나친 괴력의 문정희가 개연성을 떨어뜨린다 "
"36","추격자","10.0","2013.08.19","단연코 최고 "
"37","여친남친","9.0","2013.08.19","동성애를 인정해야 "
"38","설국열차","7.0","2013.08.19","기대가 많았으나 기대에는 못 미치는 영화였습니다 점 만점에 정도 되는 영화랄까요 "
"39","더 테러 라이브","10.0","2013.08.19","하정우의 매력이 돋보였던 영화였습니다 여름날 좋은 추억으로 선택한 영화였기에 만족 그리고 또 만족 "
"40","언어의 정원","7.0","2013.08.19","그래픽은 끝내줌 스토리와 개연성이 많이 아쉬움 너무 짧은 시간에 다 뭉퉁그려서 보는 느낌 좀 허무함 "
"41","멋진 악몽","7.0","2013.08.19","그냥 볼만하다 근데 좀 길고 약간 지루한 느낌 "
"42","감기","9.0","2013.08.19","재밌음 전시군작전지휘권이 미국에 있다는것을 이토록 확실하게 보여주는 대중상업영화가 있었던가 시나리오작가 그리고 감독 뚝심있다 "
"43","감시자들","8.0","2013.08.19","스릴 있었고 나름 재미있는 영화였음정우성의 악연 연기도 돋보였고 특히나 설경구는 공공의적 시리즈에 보던 이미지와는 많이 다른 이지로 와 닿았음 한효주씨도 좋았구요 "
"44","숨바꼭질","9.0","2013.08.19","나름 괜찮았어요 계속 궁금하게 만들고 마지막에 반전도 "
"45","더 테러 라이브","6.0","2013.08.19","기대도컸던 만큼 실망도 큰 영화였던것 같았습니다 물론 개인적으로 호불호는 갈리겠지요후반부부터 억지로 짜 맞춘다는 느낌이 강했습니다 결말도 뭐 이상하게 끝나서 실망감이 좀 남는 영화입니다 "
"46","감기","6.0","2013.08.19","개연성부족 그리고 영화 초반 주인공의 민폐행동만 없었어도추가로 미르야라는 대사가 조금만 없었어도 좋았을텐데ㅋㅋ 미르라는 이름은 콕 박혔네요 "
"47","설국열차","8.0","2013.08.19","너무 많은 것을 다룰려고 해서 약간 버거워 보이는 감은 있지만 여운 있는 결말은 오히려 좋았다우리의 삶을 기차로 묘사한 천재 감독 봉준호 디렉터 봉의 다음 영화도 기대된다 "
"48","감기","0.0","2013.08.19","돈아깝고 시간아까워서 중간에 여자친구랑 그냥 나옴수원역 CGV 관 영화 전개 자체가 지루함 스토리는 뻔히 정해져있고 결말도 다 아는 사실인데 너무 억지웃음 유발하고 전개 자체가 너무지루함 근데 알바들푼건지 정말 알바성 댓글 많네요 "
"49","설국열차","9.0","2013.08.19","이거 보고 재미없다고 평하는 사람들은 왜 무지하다고 하는지 이해가 갔음재미를 찾으려면 정통액션영화나 찾아보시길 "
"50","숨바꼭질","8.0","2013.08.19","배우들의 연기가 소름 돋았어요문정희 짱ㅎㅎ "
"51","설국열차","5.0","2013.08.19","끝이 너무 허무하다 "
"52","숨바꼭질","6.0","2013.08.19","토건족과 기득권층그리고 권력자의 야합으로 생성된 부동산고가 정책의 폐해로 인한 무주택 서민들의 애환과 지난 대선 국정원 댓글 사건에서 비롯된 나락으로 떨어져버린 경찰에 대한 불신을 그린 사회 풍자영화 "
"53","설국열차","7.0","2013.08.19","전혀 새로울거 없느 그저 그런 흔한 외국영화 딱 한줄로 평가 내렸다 "
"54","숨바꼭질","3.0","2013.08.19","재미는 있는데 내용도 없고 감동도 없고 말도 안되고 도대체 뭔 영화인지 개똥도 아닌 영화다 "
"55","숨바꼭질","10.0","2013.08.19","재미짐 여름영화로 제격 "
"56","감기","9.0","2013.08.19","매우 괜찮은 영화였습니다함께 보았던 동료들도 모두 재미있게 보았다고 "
"57","숨바꼭질","4.0","2013.08.19","도대체 왜 집에 숨어사느데요 이유라도 설명해주던가 그저 그런 공포물 헛웃음만 나옴연기느 아역들이 제일 잘한거 같네요 성인 연기자들은 다 기대이하였음 그리고 손현주의 트라우마와 결벽증은 왜죠 "
"58","숨바꼭질","10.0","2013.08.19","한마디로 대박 "
"59","터보","9.0","2013.08.19","살 아들이 아주 재밌다고 하네요 저도 재밌게 봤구요 "
"60","숨바꼭질","10.0","2013.08.19","ㅎㄷㄷ정말간만에눈가리고본영화라는 "
"61","지.아이.조 2","10.0","2013.08.19","정말 잘본겁니다 지아이조 은 못봤는데 시즌보고나니깐 시즌도이해가ㅋㅋ "
"62","숨바꼭질","0.0","2013.08.19","쓰레바꼭질 완전 허접 "
"63","감시자들","7.0","2013.08.19","초반 경찰차 추격신에서 다른 일반차량의 티 너무나는 배치가 이영화의 티나는 짜임새를 대변해준는듯 설경구의 평이함대신 정우성의 악역이 돗보여서 다행인 영화 "
"64","줄리아의 눈","9.0","2013.08.19","좋은영화네요 긴장감도있고 스릴있습니다 스토리도 탄탄합니다 범행동기에대한 후반 개연성이 약하다고들하시는데 영화 잘보시면 범인이 왜 그리되는지 충분히 공감가는 가정사가 나옵니다 다만 그내용을 범인 관점에서 풀지않았기때문에 그래보일수도있죠 여주인공도 상당히 매력적 제대로된 등신 금발 주인공 "
"65","에픽:숲속의 전설","7.0","2013.08.19","뻔했지만 은근히 괜찮게 봤네요 하지만 아이들이 더 좋아할 것같아요 "
"66","감기","6.0","2013.08.19","소재에 비해 지루한감이 좀 있는듯 했어요답답한 캐릭터들이 왜이렇게 많은지 보는내내 답답했음자식을 살리고자 하는 엄마의 마음 죽음의 공포앞에 살고자 발악하는 사람들의 심리묘사는 공감되었음 반면 죽음앞에서도 한없이 정의롭기만 한 구조대원 캐릭터는 좀 식상하네요 박민하양의 연기는 기대이상이네요 "
"67","설국열차","6.0","2013.08.19","그저그런 기대없이보면 그냥 무난한 영화반전이약하다는 느낌과함께 "
"68","감기","9.0","2013.08.19","잘 만든 한국 영화 "
"69","스카페이스","9.0","2013.08.19","결핍의 욕망이 만든 괴물의 처절한 인생사 "
"70","숨바꼭질","2.0","2013.08.19"," 어릴때 잠자기전 머리맡에서 할머니나 어머니가 해주시던 무서운 이야기 수준의 영화라는 느낌 영화가 다큐는 아니지만 사실감이 떨어지는 스토리 중반이후 헛웃음을 참을 수 없었음 외출중에 아이들만있는 아파트 현관앞에 괴한이 있음을 확인했을때 경찰에 신고하기 보다 집으로 가기 바쁜 주인공 "
"71","감기","6.0","2013.08.19","구조대원이 자신이 구조한 여성만 졸졸 따라다니다 특히 마지막 시체더미 속에서 애 찾는거등 현실성 없는 스토리 전개에 실망 "
"72","나의 PS 파트너","10.0","2013.08.19","한 번 이상 봐도 재밌음 "
"73","숨바꼭질","10.0","2013.08.19","이렇게 헬멧으로 공포를 만들 수 있구나 귀신분장보다 더 무서웠던ㅠㅠ 내용이 신선하고 새로운 공포의 장을 연 숨바꼭질 반전은 이런거다 보여준 영화 "
"74","월-E","9.0","2013.08.19","지구의 황폐화가 만들어낸 씁쓸하면서도 감동적인 스토리 마음 한켠이 따뜻해지는 영화다 "
"75","감기","8.0","2013.08.19","수작이라 말할 순 없지만 전반적으로 늘어지지않는 팽팽함과 빠른전개 좋았어요 헐리웃 작품들보다 오히려 좋은듯 "
"76","더 테러 라이브","10.0","2013.08.19","하정우가 아니였으면 망했을 영화 "
"77","케빈에 대하여","7.0","2013.08.19","난 아직도 이 영화의 마지막 대사가 이해가 안된다 왜그랬니 알고 있을줄 알았다라고 대답한 아들 그리고 지금은 모르겠다라고 시간이 다 되어 포옹하면서 끝나는 장면슬프고도 어린아이가 엄마에게 관심받고싶은걸 가족을 죽이고 친구를 죽여서 엄마의 사랑을 확인하고싶었던 것일까 너무 복잡한 영화다 "
"78","숨바꼭질","8.0","2013.08.19","중간 중간 억지설정들이 있어 스토리 흐름이 거친 면이 있긴 하지만 스릴러만 놓고 본다면 볼만한 영화네요 볼만한 영화입니다 "
"79","숨바꼭질","5.0","2013.08.19","스토리가 너무 허술함 연기나 반전은 인정보는내내 짜증남 "
"80","감기","8.0","2013.08.19","전작권의 중요성대통령이란 위치의 중요성을 생각하게 하는 영화대통령의 자리란 어떤것이며 어떤 마음가짐이어야 하는가에 대해 깊이 생각한 영화사건 후반부를 위한 전반부의 다양한 복선들과 우연들은 영화라는것을 감안하고 보면재미있게 볼 수어요미션임파서블은 현실성있어서 재밌게 본거 아니니 "
"81","숨바꼭질","9.0","2013.08.19","일단 설국보다 잼나서 추천들어간다 "
"82","설국열차","0.0","2013.08.19","알바가 득실하는것을 느끼며 평점다운용으로 쓴다 "
"83","감기","0.0","2013.08.19","최악의영화보는내내 힘들었다 "
"84","죽은 시인의 사회","10.0","2013.08.19","일 년에 두 번씩 방학때마다 보는 영화 바로 죽은 시인의 사회지금도 변화지 않는 우리의 교육 현장 이 영화 내용의 핵심은 교육 방식이다획일적인 주입식 암기식의 범주를 벗어나지 못하고 있는게 문제다서술형 논술형 시험이 끼어들고 있지만 학습 방식은 그대로다키팅 선생의 수업방식은 아직도 요원 "
"85","감기","6.0","2013.08.19"," 년작 더스틴호프만 주연 아웃브레이크 싱크로율 "
"86","용의자X","10.0","2013.08.19","진짜 사랑을 보았다 "
"87","더 테러 라이브","10.0","2013.08.19","분간 쉼없이 관객의 숨통을 조여온다 "
"88","더 테러 라이브","10.0","2013.08.19","스튜디오라는 한정된 장소에서 두시간을 이끌어가기에 충분한 스토리 쫄깃쫄깃 "
"89","더 테러 라이브","10.0","2013.08.19","하정우는 역시 실망시키지 않는다 "
"90","감기","8.0","2013.08.19","연기의 신 박민하 재미있음 근데 혹시 현실에서 저런일이 발생하면 분명 개죽음 있을수도 있겠다라는 생각이 든다 대통령역이 가장 비현실적이었음 "
"91","황금팔을 가진 사나이","9.0","2013.08.19","맥카시광풍이 전미를 강타했던 년대 마약쟁이의 극복기를 다룬 프레밍거의 두둑한 배짱이 놀랍다당시 거의가 약물중독자였던 재즈신에서 시나트라가 약을 안했을리 만무하며 그의 실감나는 연기가너무리얼하여 검열에서 수차례 보류당했다획기전인 오프닝 그래픽은 지금까지 희자되고 셜리만의 모습도 봃수있다 "
"92","숨바꼭질","10.0","2013.08.19","보는 내내 긴장감을 늦출수 없었던 영화 배우분들의 연기력은 말 할것도 없었습니다저는 개인적으로 너무 잼있게 봤네요 강추 입니당 "
"93","설국열차","3.0","2013.08.19","서로 때려죽이다마지막에 코카콜라 북극곰만생각이나는아별로다 "
"94","감기","10.0","2013.08.19","오프닝이 특히 좋았음 "
"95","숨바꼭질","10.0","2013.08.19","억지설정이 좀 거슬리는 부분이 있었지만 문정희배우님의 연기포스와 표정연기는 정말 압권이네요대한민국 배우들 정말 연기력이 각본과 연출력을 넘어서네요 "
"96","감기","5.0","2013.08.19","인물들의 개연성이 부족해 보입디다 납득가지 않는 상황도 적쟎구 연가시보다 낫다라는 얘기듣고 봤으나 영 기억에 남는건 수애정윤희 "
"97","감기","10.0","2013.08.19","영화 평점이 이상이어야 할 것 같아서 점스토리도 괜찮고 일단 연기들을 워낙 잘해서 재미있었음 논리도 좋고스펙타클한 재난영화는 아니지만 정치 사회 가족애 등 좋았습니다차인표도 대박 멋져힝 "
"98","감기","10.0","2013.08.19","한번더 보러 가고 싶네요 감기에 나오는 배우들 모두 연기력 대단합니다 보는내내 지루하지 않고 점점 갈수록 집중하면서 봤던거 같아요 이런좋은영화 감사합니다ㅠㅠㅠㅠ "
"99","에픽:숲속의 전설","10.0","2013.08.19","참 좋은 영화였어요아이들도 어른도 좋아할 영화 "
"100","설국열차","7.0","2013.08.19","열차는 빠르지만 액션은 느리다 "
"101","더 테러 라이브","7.0","2013.08.19","하정우의 원맨쇼 혼자서 분을 이끌기에는 너무 지루하다 "
"102","에픽:숲속의 전설","6.0","2013.08.19","생각 보다 화려하지 않다 생각보다 재미있지 않다 "
"103","숨바꼭질","9.0","2013.08.19","무섭고 잼어요ㅋㅋㅋㅋ 기대없이 봐서인지 정말 만족ㅋㅋㅋ "
"104","숨바꼭질","6.0","2013.08.19","연기력은 빛났지만 유치하다 스토리의 결핍 현실성 부족 "
"105","감기","6.0","2013.08.19","혁아 이런 쓰레기 영화에 출연하니 좋아 이야기가 전부 억지잖아 김치년 억지를 어거지로 정당화 시킨 개쓰레기영화 ㅋㅋ "
"106","감기","5.0","2013.08.19","무책임하고 이기적인 의사가 사람들을 구하는 구만 개연성 없는 스토리 한국영화 답다 "
"107","숨바꼭질","9.0","2013.08.19","난 개잼존잼심야로보고 집에갈때 무서워죽는줄알았네ㅋㅋㅋㅋㅋ "
"108","감기","6.0","2013.08.19","시나리오대사가 손발이 오그라들던데 "
"109","설국열차","7.0","2013.08.19","배경만 기차일뿐 그닥 새로울 것이 없는 진부한 스토리에 딱히 감동코드가 있는 것도 아니고 그렇다고 액션씬이 기막한 것도 아니고 한마디로 이도저도 아닌 상당히 어정쩡한 영화이다나중해외 개봉한다면 북미에서는 참패 유럽에서는 소폭 흥행이 예상된다카메오도 아니고 해리스는 왜 출연했는지 모르겠다 "
"110","엘리시움","9.0","2013.08.19","소재가 신선해서 많은 생각을 하게 하는 영화였다카리스마 넘치는 조디포스터의 연기가 인상에 남는다 "
"111","감기","10.0","2013.08.19","기대한것 이상의 영화 "
"112","숨바꼭질","2.0","2013.08.19","연기 잘하면 뭐히냐영화 시나리오가 이따구 인데별 개도 아깝다 "
"113","감기","8.0","2013.08.19","만약 현실에서 영화처럼 대응하면 큰일나겠지만 영화이니만큼 충분히 공감이 가고다른 블록버스터급 재난영화에서 봐다 가족애는 빠지지 않는다는 점을 생각하면너무 비난만해서는 안될것 같다 그리고 전시작전통제권이 이렇게 중요한지 몰랐다하여간 우리영화도 점점 발전하고 있다는 사실이 뿌듯하게 한다 "
"114","더 테러 라이브","2.0","2013.08.19","실망그러나 한가지 얻은게 있다면 역시욕심으로 인해 망하는군 "
"115","설국열차","3.0","2013.08.19","시사회후 해외언론이 제임스 카메룬감독등과 동등하다고 운운하길래 보았는데억 제작비가 어찌 억달러 제작비를 따라 가겠습니까 솔찍히 실망 홍보도 중요하지만 너무 과장이 있어면 안될 것 같읍니다 LTEA 광고와 같다고나 할까 초에 다 된다고 홍보 해 놓고 해보면 실망이 크죠 한국영화에 현주소 임 "
"116","숨바꼭질","9.0","2013.08.19","별 기대없이 봤는데 잼있었어요 놀라는 장면들에선 소리도 꽥 지르고 하니까 더위도 날리고 스트레스도 풀리고 현실성은 없지만 잼있습니다 "
"117","감기","8.0","2013.08.19","기대 안하고 봤는데긴박함이 영화 끝날때까지 진행되고 어설픔이 하나도 없음에 가장 놀랬네요 물론 헐리웃에서 너무 많이본 뻔한 스토리라 정말로 기대 안했는데 꽤 괜찮았어요 한가지 아역이 너무 식상한 얼굴이라 감동이 떨어진게 가장 아쉽네요 "
"118","숨바꼭질","5.0","2013.08.19","재미있다연기잘함 "
"119","감기","9.0","2013.08.19","독보적인 재난영화가될듯몰입짱 "
"120","숨바꼭질","1.0","2013.08.19","실망 중반부 이후 코미디로전환 "
"121","숨바꼭질","0.0","2013.08.19","이건정말잼없다 환경설정도 넘 말이 안되고 내용도 없고메세지도 없고억지로 끼워맞추는 요즈음 한국영화 좀재미있어져서 봤는데 이영화 보고 한국영화 수준 다시 떨어졌다정말비추 "
"122","설국열차","9.0","2013.08.19","헐리웃영화에 식상해 있던 나에게 야릇한 느낌을 갖게 해준 영화 호불호가 갈려서 갈등하다가 작금의 현실이 어떻게 녹아있나궁금해서 본 영화보기 잘했고 어린 아이들이 보기엔 좀 잔인함 "
"123","감기","7.0","2013.08.19","연가시 류의 재난 영화를 생각하며 봐서 그런지 기대 안하고 봤는데 예상을 밖으로 괜찮았네요 그래도 등장인물들이 너무 단순하게 묘사된거 같아 아쉽네요 배우들이 연출에 묻힌 느낌이 많이 들었습니다 그래도 차인표씨하고 박민하양의 재발견이었습니다 둘만 눈에 띄더군요ㅎ 많은 기대 안하고 보기 좋은 영화 "
"124","죽지않아","9.0","2013.08.19","웃음도 있으면서 많은 생각을하게 하는 영화 재미있게 봤네요 "
"125","더 테러 라이브","10.0","2013.08.19","시작부터 끝날때까지 긴장하며 봤네요역시 하정우 입니다 "
"126","문라이즈 킹덤","8.0","2013.08.19","내용은 귀엽다 색감이 너무 이쁘다 "
"127","숨바꼭질","10.0","2013.08.19","손현주 문정희 전미선 믿고 보는 배우라는 믿음을 저버리지 않은 영화입니다 상상할수 없었던 반전 더운 주말에 등 이 오싹할정도로 재미나게 봤습니다 "
"128","감기","10.0","2013.08.19","우와 보는내내 눈물도흘리고 집중장난아님 끝나고 한 분을 일어나질못했음너무집중해서 멍 진짜 재밋고 구성도좋고 무조건 추천ㅋ우리나라영화 괴물이후로 재밋게본듯ㅋ "
"129","감기","10.0","2013.08.19","점은 아니지만 점대는 유지해야 하므로 "
"130","아이언맨 3","6.0","2013.08.19","영웅물 찍기엔 로다주 넘 늙은듯 볼만하긴한데 "
"131","숨바꼭질","10.0","2013.08.19","재미 잇다 "
"132","화차","6.0","2013.08.19","미스터리물장르치고는 반전도 없다뻔한 스토리전개에 정해진 결론 "
"133","더 테러 라이브","9.0","2013.08.19","하정우 연기력 짱 볼만 합니다 한강다리도 실감나게 폭파됨 "
