"","movie_nm","score","reg_date","contents"
"1990","거북이는 의외로 빨리 헤엄친다","3.0","2013.08.16","당신이 평범한 일상을 벗어나고 싶어하는만큼만 상상하기 "
"1991","버블","4.0","2013.08.16","그 기타소리만큼이나 황량하고 가난한 마을에서의 살인 "
"1992","그리즐리 맨","6.0","2013.08.16","야만적인 자연과 무지한 인간의 비참한 만남 뒤에 웃는 문명 "
"1993","공포기형인간","3.0","2013.08.16","간음과 기형 공포에서 비롯된 소외에 대한 처절한 징벌의 말씀 "
"1994","반지의 제왕 : 왕의 귀환","9.0","2013.08.16","반지의 제왕 그 이름에 걸맞는 가장 웅장한 마무리 "
"1995","구멍","5.0","2013.08.16","당신들이 오래토록 파낸 구멍에 진짜 빠진 것은 이기심 "
"1996","반지의 제왕 : 두 개의 탑","10.0","2013.08.16","누가 이 영화를 욕할수 있으랴 "
"1997","워리어","4.0","2013.08.16","고대의 전투 신화가 만화영화의 접합 분할로 귀환하다 "
"1998","감기","9.0","2013.08.16","방금 시사회 보고왔는데 잼있었다몽싸이 죽을때 넘 슬퍼써ㅠ "
"1999","루스 체인지","1.0","2013.08.16","에 멀더와 스칼리 CSI를 즉각 파견하라 "
"2000","반지의 제왕 : 반지 원정대","9.0","2013.08.16","판타지 영화의 새역사를 쓴 전설의 시작 "
"2001","심해에서 온 괴물","1.0","2013.08.16","인간의 욕망이란 무언가를 깨우고 다시 죽음에 이르게 하지 "
"2002","피위의 대모험","3.0","2013.08.16","길 위의 주변자들을 다시 모두 만난다는 것은 환상일 뿐 "
"2003","약소국 그랜드 펜윅 이야기","1.0","2013.08.16","군비축소 또는 세 명의 피터가 귀여운 정치 소동극 "
"2004","키스 키스 뱅 뱅","7.0","2013.08.16","무지막지한 각본 무지막지한 코미디 무지막지한 영화 "
"2005","드랙퀸 가무단","2.0","2013.08.16","단지 공연차량과 그녀들의 노래가 자유로워 보일 뿐 "
"2006","플루토에서 아침을","3.0","2013.08.16","엄마 아빠 저 여기 이런 모습으로 잘 살고 있어요 "
"2007","아이언맨 3","4.0","2013.08.16","성찰하는 척 좀 안했으면 좋겠다 유치한 영상과 따로노는 내러 티브 메시지 그나마 메시지도 중후반부에선 실종 결국은 그저 그런 할리우드 블록버스터 "
"2008","사랑과 희망의 거리","3.0","2013.08.16","그들은 비둘기를 날려서 쏘고 그래서 소년은 공장에 갔다 "
"2009","숨바꼭질","7.0","2013.08.16","재밌고 깜짝깜짝 놀라는 부분도 있지만 약간 부족해보여요 재밌긴 합니다 "
"2010","허슬 앤 플로우","1.0","2013.08.16","밑바닥에서 길어올린 힙합이 도착하는 허울 좋은 희망의 빈터 "
"2011","도박꾼 밥","4.0","2013.08.16","파리 밤신사들의 멋들어진 예의만 만끽하시라 "
"2012","감기","2.0","2013.08.16","야 알바때문에 낚였다 진짜 영화관도 잘 안가고 여기에 평점고 첨 올리는데 야 이건 아니지 알바들 진짜 "
"2013","설국열차","10.0","2013.08.16","전 봉준호감독을 평소관심있게지켜보지는 않았지만 이 영화보면서 많은생각을하게되었네요 단순한 오락영화라고 생각하지마시고 그안에담긴 의미들을 생각해 보면 서관람하시면 정말 한국영화에 또다른 매력을 느끼게되네요 이영화보고 봉준호감독에게 관심을가지는계기가됬어요ㅎㅈㅎ "
"2014","아이언맨 2","5.0","2013.08.16","아이언맨에서 불안 불안하던 연출이 드디어 한계를 드러낸 작품 "
"2015","붉은 모란: 화투 승부","1.0","2013.08.16","야쿠자 여협객이 노니는 의리의 세계로 한발 초대합니다 "
"2016","북극의 연인들","3.0","2013.08.16","回文되는 그녀와 그 반복되는 인연의 눈동자 밖에는 "
"2017","감기","9.0","2013.08.16","기대하고 봤는데 역시 재미있었다 스케일도 큰거 같고 홀리우드에 버금가는스케일 안보면 후회 할 듯 했단 생각이 드는 영화였다 "
"2018","란위","3.0","2013.08.16","황량한 중국자본주의 뒤로 가라앉는 두 남자의 사랑 "
"2019","아이언맨","6.0","2013.08.16","겨우 겨우 킬링타임 정도는 된다 "
"2020","형사 이야기","2.0","2013.08.16","하루동안 당신에게 다가가기 위한 배우들의 오래된 땀 "
"2021","회사원","7.0","2013.08.16","그냥 소지섭 영화 "
"2022","린다 린다 린다","1.0","2013.08.16","한일 친선 영화로만 남아주었으면 하는 바램이 있네 "
"2023","쳐다보지 마라","6.0","2013.08.16","베니스 음습한 빨간 우비옷에 갇힌 죽음의 징후와 행로 "
"2024","당랑","1.0","2013.08.16","귀여운 사마귀를 어떻게 촬영했을까 궁금하네 "
"2025","선샤인","2.0","2013.08.16","헝가리 근현대 년 유태 가족의 지난한 이야기 "
"2026","미니버 부인","1.0","2013.08.16","계급 분열에 대한 복수만 없다면 부유한 전시 홍보 영화 "
"2027","2000년에 25살이 되는 요나","6.0","2013.08.16","년에서 년 시간은 오래 지속될까 "
"2028","레이디킬러","2.0","2013.08.16"," 톰의 귀여움과 발랄함에 한 표만 주기로 합시다 "
"2029","머시니스트","3.0","2013.08.16","당신의 죄의식 또다른 내가 되어 당신을 도배한다 "
"2030","미지의 여인에게서 온 편지","2.0","2013.08.16","영상촬영소품 모두 섬세하지만 이야기는 여전히 퇴행적일세 "
"2031","컨피던스","1.0","2013.08.16","낯익은 배우들로 뻔한 사기극을 포장해도 무언가 빈약해 "
"2032","엑스맨: 퍼스트 클래스","8.0","2013.08.16","픽션과 현실을 넘나드는 복잡하고 다채로운 각본을 완벽히 소화해내는 매튜 본의 뛰어난 연출력 마블 히어로물중 단연 최고다 "
"2033","냉혈한","2.0","2013.08.16","그것이 이상심리라 해도 본래 자본주의의 냉혈에서 나온거라네 "
"2034","174번 버스","2.0","2013.08.16","브라질 하층민을 무존재감으로 몰고가는 공권력의 총구들 "
"2035","인 더 베드룸","3.0","2013.08.16","복수로의 허술하고 지리한 긴 여정의 끝은 침실 "
"2036","아이의 시간","2.0","2013.08.16"," 아이든 어른이든 그 잔인한 동성애 배제를 벗어나 당당하기란 "
"2037","허쉬!","2.0","2013.08.16","자신만의 상처가 지워지길 바라며 그들과 밥상을 나눈다 "
"2038","사우스 스트리트의 소매치기","2.0","2013.08.16","진실된 사랑은 이데올로기도 이긴다는 허술한 범죄극 "
"2039","트랜스아메리카","2.0","2013.08.16","자신의 성정체성을 찾는데 굳이 미국을 가로지를 필요까지야 "
"2040","퍼시픽 모비딕","0.0","2013.08.16","쓰레기중의 쓰레기 cg봤나 년풍의 cg 아름답다 아주 "
"2041","69 식스티 나인","2.0","2013.08.16","그들의 거짓말 후일담은 이제 밤이 되어 아름답지도 않다 "
"2042","엑스맨 탄생 : 울버린","2.0","2013.08.16","그냥 만화를 보고말지 "
"2043","다운폴","1.0","2013.08.16","나찌즘의 마지막 모습에 연민이나 동정을 조금도 보내지 마라 "
"2044","28일 후...","8.0","2013.08.16","영리하고 기발한 좀비물 "
"2045","새벽의 저주","8.0","2013.08.16","CG에 잠식 당하기전 볼만했던 잭 스나이더의 작품 "
"2046","숨바꼭질","10.0","2013.08.16","짱 "
"2047","300","7.0","2013.08.16","다 때려 부셔라 부셔 "
"2048","왓치맨","5.0","2013.08.16","테크놀로지 덕후 잭 스나이더에겐 버거웠던 작품 "
"2049","설국열차","10.0","2013.08.16","기대를 저버리지않은 올해 최고의 영화 "
"2050","숨바꼭질","1.0","2013.08.16","개연성 없고 재미도 없고 무섭지도 않음 "
"2051","감기","9.0","2013.08.16","재난상황에 대처하는 권럭층의대응 흥디롭다실제로도 그럴것같은재미있게잘만든영화 "
"2052","감기","6.0","2013.08.16","감독의 남성 우월 주의가 있는 건가 영화에 등장하는 모든 여자 캐릭터는 다 이상하다 남자들 캐릭터도 다 이상하지만 그나마 장혁과 유해진 차인표의 월등히 우수한 캐릭터 그런데 수애 애견녀 동료 여의사까지 미르 여자들은 다 왜 이 모양인지 박진감 넘치다가 결국 한국형 신파 "
"2053","7번방의 선물","2.0","2013.08.16","만대체 왜 울어이래도 안울어빨리 울어하는 듯한 억지배우들 연기력 땜에 그나마 점마지막 돌아 보지만 않았어도 점 "
"2054","숨바꼭질","10.0","2013.08.16","스릴있고 내용전개도빠르고재밌었어요 "
"2055","더 테러 라이브","6.0","2013.08.16","치밀한 전반부와 중반부를 말아먹는 조악한 후반부 "
"2056","감기","0.0","2013.08.16","내가 한두명 취향은 이해하겠는데 솔직히 이 영화가 재밌다고 느껴지니 개새들아 알바비 얼마주디 재밌다는 넘련들이 고작 이 영화만 평점주고 딴영화는 왜 평점이 왜 없어 장난까니 감동도 억지 스토리 부재 스토리텔링 ㅄ 그냥 미니시리즈 드라마하고 뭐가 다르냐 제발좀 억지좀 고만부려 알바써서 티내지말고 "
"2057","감기","1.0","2013.08.16","차인표 덕에 그나마 별 한개보는 내내 짜증났음여주와 딸 캐릭터는 처음부터 끝까지 짜증카메오 차인표가 베스트임 "
"2058","숨바꼭질","9.0","2013.08.16","김포에서 보고왔네요넘 재미있게 봤어요아흐 "
"2059","감기","10.0","2013.08.16","흠 오전에 조조로 와이프랑 보고 왔는데 난 재밌던데 재난 영화에 드라마가끔 개그요소진지모드 였음 "
"2060","수호지 바람의 영웅 - 금모견","0.0","2013.08.16","절대 비추입니다장욱이란 무명 남자 배우의 웃는 건지 우는 건지 모를 구리고 어설픈 연기가 극의 분위기를 깨고 중거리도 엉터리입니다이건 정말 엉터리 중국영화네여 "
"2061","숨바꼭질","10.0","2013.08.16","정말 시간가는줄 모르게 재밌었어요 "
"2062","쿵후팬더: 영웅의 탄생","0.0","2013.08.16","EBS에서 방영하는 애니보다보 못한 그래픽 "
"2063","숨바꼭질","1.0","2013.08.16","정말 어이없는 내용 그냥 미친 아줌마와 딸이 집 뺏는 과정 개연성도 없고 손현주 아저씨 연기력 하나 믿고 봤지만 최근 봤던 영화중에 최악 어떤 분이 언급했지만 중간중간 어이없어서 헛웃음이 터짐 돈 아까움 "
"2064","주유소 습격사건","10.0","2013.08.16","내가 본 가장 재미있는 가장 획기적인 코메디 영화 해학감동사회비판이 알맞게 어우러졌다 아직도 배꼽잡던 기억이 "
"2065","설국열차","9.0","2013.08.16","봉준호 감독 영화는 효과적인 연출과 상징성의 함축이 인상 깊은 것 같습니다 간혹 논리적으로 이해가 안가는 부분은 있지만 뭐 만화가 원작이니 제가 근래 본 영화 중에서는 가장 기억에 남는 것 같아요 "
"2066","설국열차","0.0","2013.08.16","재미없음 "
"2067","뷰티풀 크리처스","3.0","2013.08.16","정신이 없다 "
"2068","숨바꼭질","8.0","2013.08.16","재밌게 잘 봤네요 "
"2069","달콤한 인생","10.0","2013.08.16","인생이 너무 씁쓸해서 달콤함을 잊고 살고 있진 않은가 "
"2070","마마","10.0","2013.08.16","최고의 영화 닥치고 추천 나만 고통받을순 없다 "
"2071","숨바꼭질","1.0","2013.08.16","끝나자마자극장안사람들동시에헛웃음ㅋㅋㅋㅋㅋ특히마지막분감독은개진지빨고찍었을텐데극장안사람들다터짐ㅋㅋㅋㅋ손현주아저씨때매점줌감독너는빵점 "
"2072","감기","8.0","2013.08.16","스토리가 뻔한 내용일 수는 있지만 재미잇게 봣네요 "
"2073","숨바꼭질","10.0","2013.08.16","놀이기구타고나온기분 ㅎㅎ무섭고재밌어여최고의더위를확날려주는영화내여그놈의아파트가뭐길래 ㅜ "
"2074","감기","9.0","2013.08.16","감기 잘봤네요 마지막 대한민국대통령이 미국전시작전통제권때문에 괴로워하는 차인표 미국사람 어프커트한방날려야되는데 그냥끝이나서 아쉬웠네요 "
"2075","감기","9.0","2013.08.16","간만에 날도 더운데 시원한 극장에서 몰입해서 봤네요 감동도 있구 무난히 잘만든 영화입니다 강추 "
"2076","숨바꼭질","7.0","2013.08.16","실화를 바탕으로하여 기존 공포영화들과는 색다른 맛은 있지만 그무거운 느낌을 유지해 나가려고 다다보니 종간중간 약간의 허점과 아쉬움이보이고 후반부에는 너무 오래끌지않았나 하는 아쉬움이남는다 "
"2077","본 아이덴티티","8.0","2013.08.16","본시리즈를 거꾸로 봤는데 더그라이만감독이 탄까지 하길 잘한듯폴그린그래스감독이 본시리즈를 완성햇다고 말해도 과연이 아닌듯물론 더그라이만감독도 잘햇지만 "
"2078","감기","9.0","2013.08.16","이번 달에만 영화 편 봤다 영화 안보던 내가 설국열차 더 테러 라이브 감기 덕분이다 셋 다 우열을 가리기 힘들다 "
"2079","더 테러 라이브","7.0","2013.08.16","하정우 연기만 정말 연기만 보였다 정말 적날하게 권력층을 비판 했지만 결국 마지막에는 패배하고 마는 비권력층을 보며 많이 아쉽고 결말이 조금 달랐다면 속 시원했을까 싶다 적은 제작비에 이정도 만들었다는 것 자체가 놀랍긴하지만 개인적으로 정말 재미있었다고 말하기는 힘들었다 "
"2080","설국열차","8.0","2013.08.16","나쁘지는 않지만 CG의 질이 떨어지고 한국 배우의 연기가 그다지 좋지는 않았다 "
"2081","별을 쫓는 아이","4.0","2013.08.16","보는 동안 많이 지루했다 지브리 애니를 많이 참조한 듯 보인다 스토리도 좋지 못하고 무엇보다 재미가 없다 "
"2082","설국열차","9.0","2013.08.16","왜 이렇게 평점이 낮은지 모르겠다 개인적으로 올해 들어서 본 영화 중에서는 최고라고 엄지 손가락을 들고 싶은데 평점 점이 의아하다 열차 한칸 한칸 갈수록 주인공들의 심경변화나 감정들이 잘 표현되어있고 봉준호에게 왜 봉테일이라는 별명이 붙었는지 다시 한번 느끼게 해준 영화였다 "
"2083","설국열차","10.0","2013.08.16","내 주위에 본 사람마다 다 재미없다고 그러네 그래도 한번 보고 싶긴하다슈퍼액션에서 방영할 때까지 기다릴까 "
"2084","감기","7.0","2013.08.16","시나리오 완성도나 연출이 조금 부족하네요 "
"2085","숨바꼭질","7.0","2013.08.16","나쁘지 않았다왠만한 공포물이나 귀신나오는 영화들 보다 훨씬 스릴 있었다 역시 가장 무서운건 인간이라는 느낌이 강하게 드는 영화 였구했지만 범인이 누군지 알면서는 조금 지루한 감이 없지 않아있었다사실 반전이 있다는 말을 듣고 갔던 영화여서 또 다른 반전을 기대했지만거기 까지였던것이 아쉬웠다 "
"2086","셀룰러","8.0","2013.08.16","우와예전부터진짜보고싶었는데 보고 너무너무좋았어요ㅠㅠ배우분들연기랑스토리 존짱인데 년도꺼여서 그런가ㅋㅋ장면이 너무 극대화가 안된다해야되나감독님재량부족이거나 촬영감독님이 저따구로찍어서 그런거겠죠ㅠㅠ "
"2087","감기","6.0","2013.08.16","열심히는 만들었을지도 모르겠으나 뻔하다엉성하다 "
"2088","감기","10.0","2013.08.16","대박 "
"2089","더 테러 라이브","10.0","2013.08.16","하정우 화이팅 "
"2090","감기","9.0","2013.08.16","천만관객 가능할 것 같네요정말 세세한 연출과 긴장감 몰입도 최고입니다 "
"2091","숨바꼭질","10.0","2013.08.16","ㅈㅐ밌다 ㅠㅠ "
"2092","설국열차","9.0","2013.08.16","잘만들었다 아니다 말도 많은 설국열차 직접 보고 온 소감은 잘만들었다 입니다 다만 부작 정도로 만들었다면 어땠을까 하는 아쉬움이 남습니다 칸이라는 열차의 칸 수대로 의 에피소드를 만들수 있을텐데 짧은 시간이 아쉬울뿐입니다 나중에 미국에서 미드로 만들어질지도 모르겠다는 생각이 드는군요 그 정도로 소재가 좋고 봉준호 감독의 연출이 좋았습니다 "
"2093","숨바꼭질","10.0","2013.08.16","재밋다 진심 꼭 봐라 죵나 재밋어 반전도 잇고 "
"2094","숨바꼭질","9.0","2013.08.16","이십여년만에 일의금요일과 사탄의인형을생각나게해주었다집에가는데다리가ㅎㄷㄷㄷㄷ "
"2095","감기","0.0","2013.08.16","더럽게 재미없음 정말 알바들에 넘어가 보지마세요 ㅠ "
"2096","숨바꼭질","8.0","2013.08.16","밤에 봐서 그런가집 가는데 무서웠음ㅠ 결국 남친님이 집앞까지 데려다 주고 갔다능 괜찮게 봤는데 평이 안좋은것도 있네요 다 보고 나서 머릿속으로 내용을 정리하다보면 약간씩 어설픈 장면들이 있었지만 보는 내내는 심장 쫄깃 했다능 ㅋ "
"2097","감기","10.0","2013.08.16","기대하지 않고 봤는데 너무재미있었어요장혁에 진짜사나이 매력덕분인지멋있고 인간미넘치는모습 좋았어요 "
"2098","설국열차","0.0","2013.08.16","돈 천원 아까워 정말 보지마세요 정보고싶다면 케이블에서 "
"2099","극장판 도라에몽 : 진구의 비밀도구 박물관","9.0","2013.08.16","도라에몽 재미있음다 "
"2100","숨바꼭질","6.0","2013.08.16","그럭저럭 후반으로 갈수록 흥미를 잃어가는듯 "
"2101","감기","10.0","2013.08.16","정말 재미있네요 "
"2102","감기","9.0","2013.08.16","오늘 보고 왔는데 넘재미있어요 소리지르면서 울면서 봤어요 "
"2103","언어의 정원","10.0","2013.08.16","정말 좋습니다 "
"2104","설국열차","10.0","2013.08.16","난 이거 두번 봤다 그러고도 또 보고 싶은건 정말 잘 만든 작품이기 때문 "
"2105","설국열차","8.0","2013.08.16","레미제라블 급 "
"2106","착한 여자들","3.0","2013.08.16","멍한 눈빛 정처없는 네온사인 사이 숲으로 그녀들 잠들다 "
"2107","하이난 치킨 라이스","1.0","2013.08.16","먹고 싶지만 먹을 수 없는 싱가폴 요리만 늘었네 "
"2108","러닝 스케어드","1.0","2013.08.16","폭력의 우연한 난전 MTV적 영상 이제 미련은 없네 "
"2109","우리에게 자유를","4.0","2013.08.16","낙천적이고 흥겨운 모던 타임즈의 프랑스 형을 기대한다면 "
"2110","킹콩","2.0","2013.08.16","기름기를 가능한 한 뺀 원작이 더 귀엽고 편안하군 그래 "
"2111","이터널 선샤인","6.0","2013.08.16","누가 알콜 가득한 눈과 얼음과 바다를 거부할 수 있으리 "
"2112","숨바꼭질","0.0","2013.08.16","손현주씨 문정희씨의 연기력은 정말 대단합니다그러나 스트레스를 풀러 갔다가 스트레스를 받게하는 영화라고 말하는 관객의 말에 동의합니다중반부 이후로는 답답한느낌이 있어 아쉽습니다개인적으로 평점이 후한것 같습니다 "
"2113","형무소에서 산다는 것","2.0","2013.08.16","아주 작은 자유도 소중한 그 곳의 평온하고 느긋한 시간들 "
"2114","낯선 사람들의 품속으로","2.0","2013.08.16","독일에서 영국으로 간 유태인 어린이 열차 탑승자 이야기 "
"2115","미션 임파서블 3","1.0","2013.08.16","전작들의 장점은 떠나고 남은 건 무리한 허공에의 질주뿐 "
"2116","가족의 탄생","5.0","2013.08.16","모성신화로 본 가족구성설화 근데 여기서 남자는 뭘까요 "
"2117","다빈치 코드","1.0","2013.08.16","예수가 딸을 낳았든 말든 허술한 음모감에 하품나오네 "
"2118","인사이드 맨","2.0","2013.08.16","자막의 맨 마지막에 등장하는 흑인 소년에 주목하시라 "
"2119","더 테러 라이브","5.0","2013.08.16","제작비 안들어간 이동이 없는 내용이던걸요 폭파범이돌아가신 아버지 이름으로 범행을 저지른다고 말한거 특종잡어려고 하는 내용 "
"2120","악의 손길","6.0","2013.08.16"," 어두운 방 두 악당과 한 여자를 교차하는 카메라 "
"2121","란타나","5.0","2013.08.16","당신은 당신 곁에 누구를 믿는다고 말할 수 있습니까 "
"2122","퍼스널 벨로시티","2.0","2013.08.16","세 여인의 절망 욕망 희망에 대한 잘 짜인 실같은 단편 소설 "
"2123","감기","10.0","2013.08.16","처음부터 끝까지 푸욱빠져서 봤어영 너무 잼있어요 "
"2124","소피 숄의 마지막 날들","2.0","2013.08.16","나찌즘의 소외와 성녀 신화의 싱거운 결합 그리고 변명 "
"2125","내 곁에 있어줘","5.0","2013.08.16","깊게 패인 주름살의 사랑 연기를 가장 가까이서 보고싶다면 "
"2126","더 홀","2.0","2013.08.16","당신들 광란의 사랑에 경의를 표하기엔 난 너무 늙었네그려 "
"2127","행잉록에서의 소풍","6.0","2013.08.16","우뚝 솟은 바위산이 사라지게한 것과 들추어준 것 사이에서 "
"2128","어나더 헤븐","1.0","2013.08.16","당신이 물을 들을 때마다 악의 정수가 될 수도 있단다 "
"2129","리얼 우먼 해브 커브스","2.0","2013.08.16"," 단지 남미이주민 세의 힘겹고 희망스런 성장기가 흥겨울 뿐 "
"2130","설국열차","10.0","2013.08.16","역시 봉준호는 천재 "
"2131","설국열차","1.0","2013.08.16","이영화 평점 국정원이 조작한듯청문회함 나가야한다개씨부랄 "
"2132","숨바꼭질","10.0","2013.08.16","역시 손현주씨 연기는 일품인듯 난 꽤 재밌고 무섭게 봤는데 왜 다들 최악이라고 하는지ㅜㅠ 사람들도 다 무섭다고 말하면서 영화관 나오든데 개인 취향인듯 "
"2133","러브픽션","6.0","2013.08.16","첨엔 웃긴데 중간부터 끝까지 너무 지루해 ㅠㅠ "
"2134","감기","9.0","2013.08.16","영화상영 내내 집중집중 살짝 살짝 눈물도 나고 한국영화 정말 잘 만든다는 생각하며 나왔어요 "
"2135","언어의 정원","5.0","2013.08.16","어거지로진저리나게갈는영화네요신카이는구두맟추는선수에요동네분들이다카오우산을아네요우산을안가지고나온다카오를봤어요경대선수래요유키노는누군가요둘다영화속에서서로갈는데졸업한뒤또갈브러찿아가데요정자신발사건종료에요신발은홈플러스에서봤어요유키노신발은다이어트효소방이라는데 "
"2136","감기","10.0","2013.08.16","재밌네요 "
"2137","숨바꼭질","0.0","2013.08.16","아진짜 최악 이게뭐니 "
"2138","설국열차","10.0","2013.08.16","좋아요 "
"2139","감기","9.0","2013.08.16","박민하 연기 잘해당 "
"2140","감기","10.0","2013.08.16","nice "
"2141","설국열차","10.0","2013.08.16","별로라고해서 기대안하고 봤는데 태어나서 본 영화중에 최소 열손가락안에는 들듯하다 최고다 봉준호 송강호가 옆문 터트릴때 정말 멋있었다 이건 십점이다 "
"2142","더 테러 라이브","8.0","2013.08.16","하정우 정말 연기 좋았는데 마지막 엔딩이 속시원하게 끝나지는 않아서 좀 아쉽네요그래두 되게 재밌습니다 "
"2143","숨바꼭질","10.0","2013.08.16","배우분들의 연기력이 뛰어났기에 이 영화에 몰입할수 있었던것 같습니다 "
"2144","숨바꼭질","10.0","2013.08.16","확 쪼이는 긴장감 대박이었어요흥했음 좋것네 "
"2145","언어의 정원","8.0","2013.08.16","비처럼 흐르는 감성의 호수에 물이 튄다 감수성의 성주가 돌아왔다 "
"2146","설국열차","1.0","2013.08.16","더럽게 재미없네 "
"2147","본 아이덴티티","10.0","2013.08.16","내가 두번이상본 얼마안되는 영화 "
"2148","패션, 위험한 열정","8.0","2013.08.16","집구석을다들고지랄하는영화다가해나피해나다죽이고그자리만들고가겠다고쌍둥이언니가물색신발신고겨울에나타나요도둑질하기위해동생으로들어가면폰문자가요우리나라에도둑질하러들어온그런류의영화스카프는꼼꼼히읽어야되는문자라던데농뒤에숨겨놓은게뭐지문자메세지인가농을쫌옮기면좋은데살인찐드기들 "
"2149","설국열차","8.0","2013.08.16","재미없다 개연성이 없다 졸리다 보다나갔다 송강호비중이없다 쓰레기영화다 말들이많아서 후회하더래도 보고나서 평가하자 재미없으면 욕을한바가지 댓글로 올릴려고했다 엇저녁에 집중해서 봤는데 어이가 없더라 이런말들이 왜나오는지 역시 아직도 한국무뇌충들의 단순한 수준을 보여주고있다 쓰레기영화라고 말할정도는 "
"2150","숨바꼭질","6.0","2013.08.16","영화 초반부는 긴장감도 있고 배우들 연기도 일품이었습니다 그런데 너무 갑자기 반전을 들추어 내 영화를 급 마무리를 해 아쉽더라구요 그리고 감독에게 묻고싶습니다 형이 세상에 향한 증오는 어찌된거죠 영화의 가장 중요한 소재가 순간 사라져 정말 황당했습니다 반전은 그런게 아니죠 "
"2151","퍼시픽 림","10.0","2013.08.16","처음에 주인공 형 죽고 결말에 흑인 사령관 죽음으로 희생해서 도와주고 하네유 이런 영화 볼 땐 스토리 따위는 원래 안 보고 CG만 보는데 괜찮네유 스토리는 완전 유아용이예유 시원한 통쾌함은 있어유 로봇 싸움 실력 댓나 허접하네유 영화 리얼스틸 로봇이었으면 까리했겠네유 "
