"","movie_nm","score","reg_date","contents"
"3983","컴플라이언스","5.0","2013.08.14","미국이여서 가능한 이야기가 아닐까하는우리나라와는 다른문화차이와 영화진행이 좀 답답합니다 "
"3984","베이트","4.0","2013.08.14","영화를 만들어볼려고 애는 썼으나 감독이 아직 능력이 부족한듯 하네요시간죽이기 영화로도 조금 부족합니다 "
"3985","길버트 그레이프","10.0","2013.08.14","내용연기관객 몰입 영화가 아름다우려면 보는 사람이 내가 저 장면들 어딘가에 속해있다는 느낌이 들게 하는 게 필수인데 오랜만에 그런 영화를 봤습니다대 대한민국 남자들에게 강력 추천합니다 "
"3986","감기","7.0","2013.08.14","어린애욕좀하지마라 미친것들아그러는니들은 얼마나 순수하다고 애를욕하냐한심한것들 쯧쯧 "
"3987","숨바꼭질","9.0","2013.08.14","재밋어용 ㅠㅠㅠ긴장을 늦출수업고 굳 "
"3988","더 테러 라이브","10.0","2013.08.14","매력적인영화 너무공감되고 진짜 재미있었어요 "
"3989","설국열차","10.0","2013.08.14","난재밌던데ㅋ뒤로갈수록 흥미진진했었음ㅋ재밌어서 호불호가 갈리는게 신기했음 "
"3990","마지막 4중주","10.0","2013.08.14","우리가 적는 글 몇자로 이영화를 평 하기엔힘들다 중년의 남성에서 노년으로 입문하는 내가 무엇에 딱히 감동하겠는가 화려한 화면도없고 드라마틱한 구성도없으며 수려환 대화나 글도없었다 하지만 내가슴으로 스며드는 강물같은게 눈물 혹은 굴절되어보여지는 누군가의인생 삶을 고민하고 고찰하고픈분 강추 "
"3991","베이트","6.0","2013.08.14","비키니노출에 벗어제끼는 다른영화들보다 좀더 새롭게 보이려노력은 한것같은데 그래도 조금은 부족한듯 "
"3992","오블리비언","7.0","2013.08.14","스펙터클과 스릴 액션이 조금 부족한듯 "
"3993","설국열차","7.0","2013.08.14","시나리오 누가 썼는지 전체적인 개연성이 너무 떨어짐전체적인 메시지는 좋은데 감독이 영상이 아닌 끝부분에 대사로 날로 먹을려는 느낌임전하는 메시지는 메트릭스랑 비슷한 느낌 딱 한국사회임 "
"3994","쇼생크 탈출","10.0","2013.08.14","군더더기 없이 깔끔한 영화인거 같아요 "
"3995","설국열차","8.0","2013.08.14","굳 "
"3996","숨바꼭질","9.0","2013.08.14","흥미진진하고좋았어요 연기도짱짱이고 영화보는내내긴장하고봤어요 "
"3997","더 테러 라이브","8.0","2013.08.14","휴가라 방금 조조봤습니다지난 주말 설국봤는데 장르가 많이달라 어떤게 더 괜찮타라고 말하기 좀 그렇지만개인적으로 더 테러 승비판부조리 배신함축적이네요물론 조금 아쉬운 부분이 있긴하지만 하정우씨 연기 잘하는군요둘다 스포를 읽고 봤는데 더 테러는 한국인이 공감할 수 있는영화입니다 "
"3998","숨바꼭질","10.0","2013.08.14","귀신이 나오지 않아도이렇게 오쌱할수 있다 결코 안심할수 없는흥미진진한 영화입니다 올여름 강추 ㅎㅎ "
"3999","설국열차","9.0","2013.08.14","한국영화에서 지금 이렇게 만들 감독 몇이나 될까 잘봤습니다 "
"4000","설국열차","8.0","2013.08.14","Well made movie 레미제라블 처럼 여운이 남아 한번 더봐야 할듯 "
"4001","숨바꼭질","10.0","2013.08.14","김장감 최고의 영화였어요 배우들의 열연과 현실적 이야기가 잘 어우러짐 "
"4002","감기","1.0","2013.08.14","벌써 이 사회의 때가 묻은 것 같아 아쉽네요 "
"4003","나에게서 온 편지","9.0","2013.08.14","영화의 전당에서 봤는데 재밌었어요뽀네뜨 닮아서 뽀네뜬 줄 알았는데다른 아기였구나 "
"4004","설국열차","7.0","2013.08.14","뭔가 어중간한 영화중간급 할리우드 블록버스터 영화정도한국 대표감독인데 이거밖에 안되는가 아쉽기도 하고송강호 연기도 어중간하고 "
"4005","감기","10.0","2013.08.14","설국보다 한 배는 더 재밌음스토리 진행이 속도감이 있고 몰입도가 좋아서 재밌어요설국은 솔직히 중반이후 완전 지루했어요 "
"4006","은밀하게 위대하게","5.0","2013.08.14","초딩 학년이 좋아하는 영화네여 유치하고 내용도 엉성하고 "
"4007","러브 액츄얼리","2.0","2013.08.14","이해가 안됨 "
"4008","코요테 어글리","10.0","2013.08.14","가장 잼있게 본 영화 중에 하나 몇번을 봤어도 질리지 않아요 넘 좋네요 ㅠㅠ "
"4009","세라핀","6.0","2013.08.14","좀 지루하다 해야되나 "
"4010","설국열차","5.0","2013.08.14","명예를 걸고 말하는데 재미도 감동도 아무것도 없는 쓰레기 영화 "
"4011","광해, 왕이 된 남자","9.0","2013.08.14","재미있었습니다 이병헌 연기 쩌내요 "
"4012","춤추는 숲","6.0","2013.08.14","저는 날카로운 톱날 소리가 거북했습니다 말하고 싶은 것을 살리는 효과적인 장치였을 수 있으나 제게는 피해자와 가해자로 단순하게 이등분하는 일방통행처럼 여겨졌습니다 마지막합창 렛잇비처럼 좀더 유쾌한 에피소드들이 많지 않은 것도 아쉬웠지만 성미산 사람들의 년 후 이야기를 기대해 볼게요 "
"4013","설국열차","10.0","2013.08.14","세계질서를 농락하는 미국 그리고 그 미국을 조종하는 미국자본 월포드는 월스트리트와 포드사의 합성어임이 분명하다 난 세상에 둘도없는 천재감독이야라는 외침을 들을 수 있는 영화 "
"4014","누군가 내게 키스했다","4.0","2013.08.14","어울리지도 않는 남의옷 입은 느낌 "
"4015","설국열차","5.0","2013.08.14","디워가 떠오르는건 왜일까 "
"4016","군사통제구역 팔이공지대","2.0","2013.08.14","스토리구성 미흡 몇몇 배우 연기력부족 "
"4017","천녀유혼","10.0","2013.08.14","동양적 환타지는 이렇게 만들어야 된다고 보여준 교과서 "
"4018","텍사스 킬링 필드","8.0","2013.08.14","텍사스의 현실을 과장없이 날 것 그대로 보여준다치안 부재 최강대국 미국에서마저 버림받은 공권력 사각지대 끊이지 않는 폭력과 살인 범죄자는 대낮에도 활보하며 인권이 유린된 도시그런데 이건 텍사스만의 문제가 아닌 미국의 문제 "
"4019","설국열차","1.0","2013.08.14","그렇게 심각한 주제를 가지고 어울리지 않는 상황설정과 스토리전개는 도저히 이해 할 수 없는 부분이었고 동의가 되지 않는 부분이었다 차라리 심각하지 않은 주제였다면 차라리 나았을 것이다 "
"4020","설국열차","10.0","2013.08.14","설국열차 만세 "
"4021","설국열차","10.0","2013.08.14","최고였다 "
"4022","설국열차","4.0","2013.08.14","기대이하였다 송강호 주연이줄 알고 봣는데 딸애도 비중 있을줄 알았는데 쨋든 두번봣지만 확인했다 차라리 더테러라이브가 감시자가 더 나았다 옆에 아주머니 주무시더라ㅡㅡ "
"4023","설국열차","6.0","2013.08.14","도저히 이해할 수 없고 흥미없는 장면의 연속 브레인은 있으나 바디가 없게 느껴지는 영화 올해 최대의 미스터리 "
"4024","숨바꼭질","8.0","2013.08.14","기대되는 손현주 연기 "
"4025","감기","1.0","2013.08.14","오우 설국이랑 더테러 다봐 볼게없는데 영악스런 꼬마하나때문에 이거 보기싫음 "
"4026","더 테러 라이브","9.0","2013.08.14","마지막 엔딩컷의 하정우씨 눈을 바라보다 그만 눈물을 보였습니다 신뢰가 거짓이 되고 정의가 막되먹은 의리에 막혀 눈이 가려진 세상 어쩜 우리 모두가 테러리스트 일지 모르겠습니다 "
"4027","설국열차","9.0","2013.08.14","기대이상이었다 "
"4028","설국열차","10.0","2013.08.14","관객에게 많은 생각을 하겠끔 물음을 던지는 영화 다소 지루하다고 생각을 할수 있으나 영화의 줄거리를 조금이라도 이해를 하고 본다면 설국열차 과연이라는 찬사가 나올만하네요 "
"4029","다크 아워","4.0","2013.08.14","새로운 형태의 외계인은 관심을 주었지만나머지는 그저 그런 영화 "
"4030","더 테러 라이브","10.0","2013.08.14","설국열차냐더테러라이브냐고민끝 남편님이랑 더테러라이브를 선택해서 보고왔습니다정말이지한 건물한 공간안에서 어쩌면 저렇게 하정우의 연기력 하나로 긴장감을 늦추지못하게 만들수있을까하는 생각이 드네요 정말 후회없는 영화선택이었구요정말 쵝오였어요간만에 영화다운 영화 볼수있어서 굿 "
"4031","더 씽","7.0","2013.08.14","에이리언을 생각나게 하는 영화 뛰어나게 재미 있지도않고 재미없지도 않음 봐줄만한 영화라고 생각되고 조금의 스릴러도 가미 보셔도 후회는 없을듯 "
"4032","설국열차","10.0","2013.08.14","평점이 너무 안좋아서 기대 안하고 봤는데 저는 정말 재미있게봤습니다 단 호붏호가 확실이 갈리는 영화인거 같습니다 "
"4033","설국열차","5.0","2013.08.14","스토리가 넘 허구 적이다 만화 같다 "
"4034","설국열차","5.0","2013.08.14","전작들에선 암울한 상황 속에서도 빛을 발하던 봉준호 특유의 위트를 찾아보기 어렵다 Lost in translation 틸다 스윈튼이나 옥타비아 스펜서 같은 명배우들이 출연하지만 평면적인 캐릭터들 앞에선 그들도 속수무책 흥미로운 설정에 뛰어난 배우들 사실적인 세트 등 좋은 재료를 두고도 제대로 활용하지는 못한 느낌 "
"4035","허리케인","8.0","2013.08.14","년 세트장을 짓고 현실과 별차이를 못느끼게 했던 웅장함에 이 작품이 년전 작품인가 의심할 정도 였지요 개연성면에선 끼어맞춘 느낌이 있지만 결론도 희망을 주는 결말로 서로의 화해와 이해라는 문명의 이기가 아닌 어울림이라고 말하고 있는 듯 했어요 의외의 값진 영화를 만난 듯 추천 합니다 "
"4036","이재수의 난","10.0","2013.08.14","결론은 개독척살하여튼 그때나 이때나 썩어빠져서 "
"4037","행복","10.0","2013.08.14","신세계옌벤거지쉐키들 대체 언제오는거여 "
"4038","더 테러 라이브","10.0","2013.08.14","현실의 벽을 깨닫게 하는 영화 "
"4039","숨바꼭질","10.0","2013.08.14","무섭지만 너무재밌게 봣어요 연기자들의 연기도매우 멋졌어요 "
"4040","숨바꼭질","7.0","2013.08.14"," 우리가 사는 현 대한민국 세상에서 집이란 공간이 단순히 거주지를 떠나 얼마나 중요한 부분을 차지하고있는지 영화는 전해준다 누구나 지금을 살면서 이 집에 대해서 깊게 안 생각해본 자 없을 것이다 영화 숨바꼭질은 단순한 충격공포스릴러의 재미를 넘어서 그러한 메시지까지 깊게 전해준다 "
"4041","설국열차","10.0","2013.08.14"," 애국심을 떠나서 객관적으로 평가하자면 년간 본 수많은 영화중 손에 꼽을정도의 수작입니다봉준호의 연출력과 크리스에반스송강호의 연기력에 찬사를 보냅니다 "
"4042","뜨거운 안녕","1.0","2013.08.14","ㅡㅡ "
"4043","아찔한 십대","6.0","2013.08.14"," 되돌아 갈 곳 조차 잃어버린 사람에 비해 다시 되돌아 올 곳이 있다는건 너무나 행복한 일 "
"4044","러브 앤 프렌즈","10.0","2013.08.14","활기없던 내 생활에 잠깐이나마 웃음을 준 영화 이런 영화 너무 좋다 마음을 환기 시키고 싶을때 한번씩 꼭 보세요 "
"4045","낮술","10.0","2013.08.14","완전웃겨요 ㅋㅋ 이런영화많아졌으면 좋겠습니다 ㅠㅠ "
"4046","마지막 4중주","5.0","2013.08.14","명불허전 조연 배우들을 동원했으나 갈피를 잡지 못하는 전개와 부실한 대사들이 난무감독의 의도와 색채는 이해했으나 완성도의 미비함은 어쩔 수 없더라 "
"4047","파퍼씨네 펭귄들","10.0","2013.08.14","유아용이라서 기대 안 하고 봤는디 댓나 재밌게 봤어유 물론 허무맹랑한 스토리이지만 펭귄들이 너무나 귀여워서 보는내내 귀엽다는 말이 계속 나왔네유 가족끼리 보면 마음 따뜻해지는 영화예유 가족끼리 볼 수 있는 영화 잘 없는데 이 영화는 추천이예유 "
"4048","여인의 향기","9.0","2013.08.14","가치있는 영화다 인생에 교훈을 준다 "
"4049","위대한 개츠비","3.0","2013.08.14","원작팬들에게 이영화는 재앙이다맙소사 "
"4050","당신은 아직 아무것도 보지 못했다","10.0","2013.08.14","삶과 죽음 현실과 환상의 경계가 희미해지며 세계는 분열하고 통합된다 이 놀랍고 창의적인 실험에 도전한 늙은감독의 영화를 보고 부끄러움을 느끼는 젊은감독들이 많았으면 좋겠다 그럼 앞으로 다채롭고 창의적인 영화가 만들어지는 기대를 해도 괜찮을테니깐 "
"4051","은밀하게 위대하게","8.0","2013.08.14","다들재미없다고해서 늦게본영화인데전 나름재밌게보았습니다살짝눈물도났고요 "
"4052","더 테러 라이브","0.0","2013.08.14","개 망 작 "
"4053","더 테러 라이브","9.0","2013.08.14","좁은 공간에서의 답답함을 잊게해주는 배우 하정우 놀랍다 "
"4054","광해, 왕이 된 남자","10.0","2013.08.14","근래 본 한국영화중 최고 "
"4055","설국열차","4.0","2013.08.14","온난화로 인해 끊임없이 달리는 열차속에서 기본 인간적인 대우를 누리고싶은 생존자들이 펼치는 스릴러 문이 한칸 한칸 열릴때마다 고조되는 장면들 참신한 발상과시도는 좋았으나 스토리가 첨과끝으로 맺어지지않았다 발상하나만으로 점드립니다 "
"4056","가타카","10.0","2013.08.14","고품격 sf "
"4057","춤추는 동물원","3.0","2013.08.14","전형적인 틀이라도 독특한 아이디어나 영상이 있다면 지루해지진 않을텐데 예상대로 진행하고 예상한만큼도 못 보여준다 전문연기자가 아니니 연기 못하는건 이해하더라도 연출이 대사가 너무하다 특히 음악나올때의 뮤비스러운 플레시백 "
"4058","저수지의 개들","9.0","2013.08.14","의심에 의심을 거듭하는데 그걸 또 관객 입장에서 의심케하는 게 이 영화의 재미가 아닐런지다만 기대했던 반전이 없다는게 아쉬움그래서 평점은 점 "
"4059","남영동1985","10.0","2013.08.14","고문이란게 얼마나 인간의 심성을 말살 하는지 교훈을 주는영화 "
"4060","위대한 개츠비","10.0","2013.08.14","난해하지만 한번 돌아보게 하네여 "
"4061","감기","10.0","2013.08.14","최고의 영화입니다꼭 보세요 "
"4062","페어런트 트랩","10.0","2013.08.14","몇번을 봐도 재밌네요ㅎㅎ "
"4063","굿 윌 헌팅","10.0","2013.08.14","정말 감동 그 자체 봐도 또 봐도 질리지 않는 영화 "
"4064","설국열차","6.0","2013.08.14","너무 빈틈이 많다 "
"4065","혹성탈출: 진화의 시작","10.0","2013.08.14","별 기대 안했던 영화였는데 너무 훌륭하다 지구위의 동물들의 지능수준이 모두 비슷하다면 가장 약한건 인간일지도 "
"4066","더 테러 라이브","1.0","2013.08.14","내 여친이 구역질 날뻔했다 기분이 이상해 지는 기분 더러운 영화 그러나 집중은 잘되는 ㅋ 하정우 원맨쇼 "
"4067","설국열차","7.0","2013.08.14","욕심을 너무 부린 영화 ㅋ 한국인들은 정치영화 안좋아 함 "
"4068","지난여름, 갑자기","10.0","2013.08.14","최고이 짧은영화 한편으로 감독님과두 배우를 완전 사랑하게 됬다처음이다보는내내 설렜던 영화 굿 "
"4069","남영동1985","10.0","2013.08.14","불과 년대의 "
"4070","더 테러 라이브","5.0","2013.08.14","아쉬움이 너무나도 큰 생방송 하정우로도 역부족 "
"4071","퍼시픽 림","10.0","2013.08.14","아틀란틱림을 먼저보고 볼필요가 있다 "
"4072","스승의 은혜","6.0","2013.08.14","개연성과 살인 동기도 부족하다 반전도 어설프다 너저분하게 늘어놓고 정리도 못한 채 끝내버렸다 장애아들로 인한 제자들에 대한 왜곡된 심성 그로 인해 제자들의 상처 상처받은 동창들을 죽임으로써 선생에게 복수하는 그녀 장애아들을 둔 선생의 심리와 상처받은 미자의 심리를 좀 더 깊이 있게 다뤘으면 좀 더 이해하기 쉽지 않았을까 "
"4073","두 개의 달","10.0","2013.08.14","박한별 사랑해요 "
"4074","설국열차","6.0","2013.08.14","이건 뭐지 재미도 아니요 액션도 아니요 스릴러도 아니고극장이 등을 만든 영화 상영관 수가 젤 만은데 등을 못하면 바보지 "
"4075","광해, 왕이 된 남자","6.0","2013.08.14","데이브 이 작품의 근본적인 한계 "
"4076","베를린","5.0","2013.08.14","모든면에서 어정쩡하다 "
"4077","그랑블루","10.0","2013.08.14","수영장에서옷입은채로술따르는장면이아주재밌네명방이다바다속으로사라지는자크는아직도이야기가없다왜침대위에서물에잠겨죽는가 자크는숨을내가알기론분을참는다완점범죄는기억이지워진자리에서또산다아름다운장면이가득하나세월지나보니누굴죽이기위해찍은영화다 "
"4078","여왕 마고","7.0","2013.08.14","영화의 명성과는 다소 거리감이 있다고 느꼈다당시의 시대적 배경이나 우리와 공감되지않는 사회관습으로 인해 등장인물들과 같이 시나리오에 맞게 호흡하지못해서 였는지는 모르겠지만 좀 지루한감이 있었다 남는것은 그저 신분을 넘는 사랑이란 단어정도라고 함축해서 말하고싶다 "
"4079","수영장","9.0","2013.08.14","뜨거운 태양아래 휴가지의 나른하고 따분한 분위기가 영화의 전개와 함께 불현듯 초가을의 스산함으로 바뀐다 특히 영화 막바지 두 인물간의 서스펜스가 절창이다 지극히 예의바르게 오가는 평온한 어조 속에 칼날과 적의가 마주치는 눈빛 속에 불안과 음모가 또아리를 틀고있는 상황을 절묘하게 담았다 "
"4080","설국열차","8.0","2013.08.14","별 기대 안하고 봤는데 정말 괜찮다 한국 영화 수준을 업그레이드 시킨듯철학적이고 스케일도 크고 "
"4081","타짜","9.0","2013.08.14","도박소재를 홍콩영화의 스타일과 관습적틀에서 벗어나 진정한 한국식 색깔과 대담함과 창의력으로 풀어낸 뛰어난 영화 "
"4082","세상의 끝까지 21일","10.0","2013.08.14","굿 "
"4083","도둑들","7.0","2013.08.14","오션스과 홍콩영화의 추억을 최동훈 감독 특유의 재기로 버무린 오락영화 "
"4084","더 테러 라이브","6.0","2013.08.14","한공간에초점을맞춰계속영화가진행되니답답하고기울어진건물하며 머리가어찔어찔속이거북거북 단순한전개에하정우의연기가빛난듯나름긴장감도있고색다른시도긴했다억울한일도없어야겠지만이런테러도절대없어야할듯 말만국민국민하는정치인들땜에 국민들끼리미워하고테러하고그러진말자 미움은일본넘들에게나터트리고 "
"4085","황해","10.0","2013.08.14","한국적 우월감과 위선을 비꼼과 동시에 한세기전에는 동포였던 조선족들이 역사와 시대의 파란속에 서로 찢어져 비참한 인생을 살아갈 수 밖에 없는 근원적인 슬픔이 담긴영화 한국사회의 더러운 치정관계에 이용되어 목숨을 걸로 서로를 죽여야하는 비극 조선족 한국인도 아니고 중국인도 아닌 그들이 갈곳은 황해뿐 "
"4086","더 클럽","8.0","2013.08.14","두 미남들을 보는 재미 뻔할것 같았지만 후반부의 복수 스릴러적 요소와 팜므파탈이 조금만 더 강했으면하는 아쉬움 "
"4087","전설의 주먹","9.0","2013.08.14","종합격투기 기본따지는 사람은 이걸 드라마 영화로 본것인가 다큐로 본것인가 충분히 러닝타임동안 재미를 주었으면 영화의 기본은 한것 "
"4088","슈퍼쇼4 3D","10.0","2013.08.14","음량도 너무 좋았고 재밌게 편집도 잘된거 같아요 D에다가 음량도 큰게 정만 코서트 같아서 너무 좋았어요 저 처럼 콘서트 못가는 사람들에게는 너무 좋은 기회인거 같아요 저는 개인적으로 너무 재밌고 보는 내내 행복했어요 정말 최고에요 "
"4089","콘스탄틴","3.0","2013.08.14","평점이 높아서 본건데 끝까지 보는게 힘들었음 퇴마영화로는 재미없고 기독교적 환타지로는 괜찮음 "
"4090","섹스 아카데미","10.0","2013.08.14","완전웃김ㅋㅋ무서운영화시리즈좋아하면 백퍼좋아할꺼임 "
"4091","언어의 정원","6.0","2013.08.14","맑고 투명한 대 판타지 "
"4092","더 테러 라이브","9.0","2013.08.14","재밌더군요 "
"4093","비스트 앵콜 콘서트 3D","10.0","2013.08.14","짱짱비스트 "
"4094","이터널 선샤인","10.0","2013.08.14","늦게피는 해바라기 행복탱이야 행복하게 살고 있니나에게 이 영화를 소개시켜준 니가 생각난다 행복하게 살길 바래 언젠가 이글의 보면 날 한번이라도 생각해줬으면 좋겠어 너의 간절한 친구 민종 "
"4095","위대한 개츠비","4.0","2013.08.14","감동을 기대한 사람들은 원작을 안 읽은 분들인가 싶다 솔직히 원작도 욕망의 지랄발광에 관한 거지 그다지 감동적이진 않는데 희대의 로맨스라도 기대했나 개츠비가 그 여자를 사랑한 것도 결국은 환상일 뿐이었다는 것이 전부였는데 "
"4096","설국열차","3.0","2013.08.14","ㅜㅡ 지루해요 "
"4097","설국열차","9.0","2013.08.14","조금 잔인한 장편 있어여 근데 스토리는 좋습니다 "
"4098","신용문객잔","10.0","2013.08.13","임청하 아 정말 무협영화에서 임청하씨만큼 카리스마있는 배우는 없다 앞으로도 없을것이다 "
"4099","릴라 릴라","8.0","2013.08.13","소박한 사랑이 불러 온 돌풍 큰 재미를 찾을 수는 없지만 소소한 장면들에 웃음이 숨어있다 남자 주인공의 표정연기가 재미를 더한다 "
"4100","카라스 : 프로퍼시","9.0","2013.08.13","첫화 오프닝이 좀 많이 작살이긴 함 그리고 대결 장면도 좀 많이 작살이긴 함 그 외 부분은 걍 그럭저럭 "
"4101","퍼시픽 림","1.0","2013.08.13","왠 못생긴 쪽바리년이 나왔길래 유심히 봤더니 변태관음증에 연기도 못하는 전형적인 쪽바리하등동물였다 연기를 너무 못해서 보는 내내 짜증만 났다 "
"4102","설국열차","8.0","2013.08.13","탁월한 리듬감 있는 한 폭의 클래식 같다 근데 결말까지 "
"4103","에픽:숲속의 전설","9.0","2013.08.13","전개도 군더더기없고 영상미도 훌륭하고 시간가는줄 모르고봤네에 "
"4104","아이언맨 3","5.0","2013.08.13"," 순서 무슨 사골국물도 아니고 계속 우려먹냐 ㅋㅋ "
"4105","설국열차","3.0","2013.08.13","오늘보고 정말 실망했습니다 이런 영화가 어떻게 평점을 이렇게 잘 받을 수 있는지 의문이군요 중간 이후로는 지겨움이 느껴졌습니다 "
"4106","설국열차","6.0","2013.08.13","리뷰나 여러 자료를 찾아보고 갔음에도 불구하고뭔가 거창하게 시작해 너무 끌다가 급하게 끝내버린 영화틸다 스윈튼 연기 하나하나는 정말 인상 깊었다 "
"4107","더 테러 라이브","10.0","2013.08.13","탄탄한 극본과 연기력이면 모든게 다되다는 널 보여주는 교과서 "
"4108","설국열차","10.0","2013.08.13","상상력에 감탄했습니다 "
"4109","설국열차","10.0","2013.08.13","입이간지럽다 "
"4110","컨테이젼","6.0","2013.08.13","바이러스가 전파되는 과정은 흥미롭게 그렸다 잔잔한 스릴러물이라 약간은 지루할수도 엔딩에 스리슬쩍 병의 진원지를 알려주는 허를 찌르는 친절함ㅋㅋ "
"4111","글래디에이터","10.0","2013.08.13","완벽 "
"4112","감기","10.0","2013.08.13","시사회 당첨되서 방금 보고 왔어요 무서워요 세상이 저렇게 될까봐요즘 저런 영화 자주나오잖아요 끔찍해요 재미있게 잘봤어요기대한만큼 ㅎㅎ 대박나길 "
"4113","숨바꼭질","9.0","2013.08.13","비명이 남부하던 부더운 여름에 딱 맟는 영화 "
"4114","더 테러 라이브","8.0","2013.08.13","하정우를 위한 하정우를 위한 하정우 영화 ㅊㅊㅊ "
"4115","그랑블루","10.0","2013.08.13","나 대학시절 봤던 이 영화는 명작중의 명작이었지 레옹과 함께 뤽베송이라는 감독을 알게 해준 대표적 작품이라고 생각함 삶에대한 상당한 성찰을 담고 있는 듯한 단순하면서도 여운이 남는 명작이었음 이후에 헐리우드에 진출한 감독이 택시 시리즈를 찍는것을 보면서 요새는 기대를 접고 살긴 하지만 "
"4116","터보","10.0","2013.08.13","진짜 재미있었어요 애들도 만족 "
"4117","설국열차","8.0","2013.08.13","언듯 진부한듯 보이나 제한된 공간에서의 내용전개인것을 감안하면 꽤 좋다부분적인 묘사도좋다 역시 봉준호다란말이나오지만 전반적인 스토리라인이나 고아성과 송강회의 존재의의에 강한이질감을느낀다 "
